,Title,Subjects,Authors,Abstracts
197,Analyzing Divergence for Nondeterministic Probabilistic Models,Logic in Computer Science,"['Hao Wu', 'Yuxi Fu', 'Huan Long', 'Xian Xu', 'Wenbo Zhang']","Branching and weak probabilistic bisimilarities are two well-known notions capturing behavioral equivalence between nondeterministic probabilistic systems. For probabilistic systems, divergence is of major concern. Recently several divergence-sensitive refinements of branching and weak probabilistic bisimilarities have been proposed in the literature. Both the definitions of these equivalences and the techniques to investigate them differ significantly. This paper presents a comprehensive comparative study on divergence-sensitive behavioral equivalence relations that refine the branching and weak probabilistic bisimilarities. Additionally, these equivalence relations are shown to have efficient checking algorithms. The techniques of this paper might be of independent interest in a more general setting."
198,Multiple Ways of Working with Users to Develop Physically Assistive Robots,Human-Computer Interaction,"['Amal Nanavati', 'Max Pascher', 'Vinitha Ranganeni', 'Ethan K. Gordon', 'Taylor Kessler Faulkner', 'Siddhartha S. Srinivasa', 'Maya Cakmak', 'Patrícia Alves-Oliveira', 'Jens Gerken']","Despite the growth of physically assistive robotics (PAR) research over the last decade, nearly half of PAR user studies do not involve participants with the target disabilities. There are several reasons for this -- recruitment challenges, small sample sizes, and transportation logistics -- all influenced by systemic barriers that people with disabilities face. However, it is well-established that working with end-users results in technology that better addresses their needs and integrates with their lived circumstances. In this paper, we reflect on multiple approaches we have taken to working with people with motor impairments across the design, development, and evaluation of three PAR projects: (a) assistive feeding with a robot arm; (b) assistive teleoperation with a mobile manipulator; and (c) shared control with a robot arm. We discuss these approaches to working with users along three dimensions -- individual- vs. community-level insight, logistic burden on end-users vs. researchers, and benefit to researchers vs. community -- and share recommendations for how other PAR researchers can incorporate users into their work."
199,Selective-Stereo: Adaptive Frequency Information Selection for Stereo Matching,Computer Vision and Pattern Recognition,"['Xianqi Wang', 'Gangwei Xu', 'Hao Jia', 'Xin Yang']","Stereo matching methods based on iterative optimization, like RAFT-Stereo and IGEV-Stereo, have evolved into a cornerstone in the field of stereo matching. However, these methods struggle to simultaneously capture high-frequency information in edges and low-frequency information in smooth regions due to the fixed receptive field. As a result, they tend to lose details, blur edges, and produce false matches in textureless areas. In this paper, we propose Selective Recurrent Unit (SRU), a novel iterative update operator for stereo matching. The SRU module can adaptively fuse hidden disparity information at multiple frequencies for edge and smooth regions. To perform adaptive fusion, we introduce a new Contextual Spatial Attention (CSA) module to generate attention maps as fusion weights. The SRU empowers the network to aggregate hidden disparity information across multiple frequencies, mitigating the risk of vital hidden disparity information loss during iterative processes. To verify SRU's universality, we apply it to representative iterative stereo matching methods, collectively referred to as Selective-Stereo. Our Selective-Stereo ranks $1^{st}$ on KITTI 2012, KITTI 2015, ETH3D, and Middlebury leaderboards among all published methods. Code is available at this https URL."
200,"A Survey of Geometric Graph Neural Networks: Data Structures, Models and Applications",Machine Learning,"['Jiaqi Han', 'Jiacheng Cen', 'Liming Wu', 'Zongzhao Li', 'Xiangzhe Kong', 'Rui Jiao', 'Ziyang Yu', 'Tingyang Xu', 'Fandi Wu', 'Zihe Wang', 'Hongteng Xu', 'Zhewei Wei', 'Yang Liu', 'Yu Rong', 'Wenbing Huang']","Geometric graph is a special kind of graph with geometric features, which is vital to model many scientific problems. Unlike generic graphs, geometric graphs often exhibit physical symmetries of translations, rotations, and reflections, making them ineffectively processed by current Graph Neural Networks (GNNs). To tackle this issue, researchers proposed a variety of Geometric Graph Neural Networks equipped with invariant/equivariant properties to better characterize the geometry and topology of geometric graphs. Given the current progress in this field, it is imperative to conduct a comprehensive survey of data structures, models, and applications related to geometric GNNs. In this paper, based on the necessary but concise mathematical preliminaries, we provide a unified view of existing models from the geometric message passing perspective. Additionally, we summarize the applications as well as the related datasets to facilitate later research for methodology development and experimental evaluation. We also discuss the challenges and future potential directions of Geometric GNNs at the end of this survey."
201,RealCustom: Narrowing Real Text Word for Real-Time Open-Domain Text-to-Image Customization,Computer Vision and Pattern Recognition,"['Mengqi Huang', 'Zhendong Mao', 'Mingcong Liu', 'Qian He', 'Yongdong Zhang']","Text-to-image customization, which aims to synthesize text-driven images for the given subjects, has recently revolutionized content creation. Existing works follow the pseudo-word paradigm, i.e., represent the given subjects as pseudo-words and then compose them with the given text. However, the inherent entangled influence scope of pseudo-words with the given text results in a dual-optimum paradox, i.e., the similarity of the given subjects and the controllability of the given text could not be optimal simultaneously. We present RealCustom that, for the first time, disentangles similarity from controllability by precisely limiting subject influence to relevant parts only, achieved by gradually narrowing real text word from its general connotation to the specific subject and using its cross-attention to distinguish relevance. Specifically, RealCustom introduces a novel ""train-inference"" decoupled framework: (1) during training, RealCustom learns general alignment between visual conditions to original textual conditions by a novel adaptive scoring module to adaptively modulate influence quantity; (2) during inference, a novel adaptive mask guidance strategy is proposed to iteratively update the influence scope and influence quantity of the given subjects to gradually narrow the generation of the real text word. Comprehensive experiments demonstrate the superior real-time customization ability of RealCustom in the open domain, achieving both unprecedented similarity of the given subjects and controllability of the given text for the first time. The project page is this https URL."
202,Implicit high-order gas-kinetic schemes for compressible flows on three-dimensional unstructured meshes II: unsteady flows,Mathematics > Numerical Analysis,"['Yaqing Yang', 'Liang Pan', 'Kun Xu']","For the simulations of unsteady flow, the global time step becomes really small with a large variation of local cell size. In this paper, an implicit high-order gas-kinetic scheme (HGKS) is developed to remove the restrictions on the time step for unsteady simulations. In order to improve the efficiency and keep the high-order accuracy, a two-stage third-order implicit time-accurate discretization is proposed. In each stage, an artificial steady solution is obtained for the implicit system with the pseudo-time iteration. In the iteration, the classical implicit methods are adopted to solve the nonlinear system, including the lower-upper symmetric Gauss-Seidel (LUSGS) and generalized minimum residual (GMRES) methods. To achieve the spatial accuracy, the HGKSs with both non-compact and compact reconstructions are constructed. For the non-compact scheme, the weighted essentially non-oscillatory (WENO) reconstruction is used. For the compact one, the Hermite WENO (HWENO) reconstruction is adopted due to the updates of both cell-averaged flow variables and their derivatives. The expected third-order temporal accuracy is achieved with the two-stage temporal discretization. For the smooth flow, only a single artificial iteration is needed. For uniform meshes, the efficiency of the current implicit method improves significantly in comparison with the explicit one. For the flow with discontinuities, compared with the well-known Crank-Nicholson method, the spurious oscillations in the current schemes are well suppressed. The increase of the artificial iteration steps introduces extra reconstructions associating with a reduction of the computational efficiency. Overall, the current implicit method leads to an improvement in efficiency over the explicit one in the cases with a large variation of mesh size."
203,TempCompass: Do Video LLMs Really Understand Videos?,Computer Vision and Pattern Recognition,"['Yuanxin Liu', 'Shicheng Li', 'Yi Liu', 'Yuxiang Wang', 'Shuhuai Ren', 'Lei Li', 'Sishuo Chen', 'Xu Sun', 'Lu Hou']","Recently, there is a surge in interest surrounding video large language models (Video LLMs). However, existing benchmarks fail to provide a comprehensive feedback on the temporal perception ability of Video LLMs. On the one hand, most of them are unable to distinguish between different temporal aspects (e.g., speed, direction) and thus cannot reflect the nuanced performance on these specific aspects. On the other hand, they are limited in the diversity of task formats (e.g., only multi-choice QA), which hinders the understanding of how temporal perception performance may vary across different types of tasks. Motivated by these two problems, we propose the \textbf{TempCompass} benchmark, which introduces a diversity of temporal aspects and task formats. To collect high-quality test data, we devise two novel strategies: (1) In video collection, we construct conflicting videos that share the same static content but differ in a specific temporal aspect, which prevents Video LLMs from leveraging single-frame bias or language priors. (2) To collect the task instructions, we propose a paradigm where humans first annotate meta-information for a video and then an LLM generates the instruction. We also design an LLM-based approach to automatically and accurately evaluate the responses from Video LLMs. Based on TempCompass, we comprehensively evaluate 8 state-of-the-art (SOTA) Video LLMs and 3 Image LLMs, and reveal the discerning fact that these models exhibit notably poor temporal perception ability. Our data will be available at \url{this https URL}."
204,Computer-Controlled 3D Freeform Surface Weaving,Graphics,"['Xiangjia Chen', 'Lip M. Lai', 'Zishun Liu', 'Chengkai Dai', 'Isaac C.W. Leung', 'Charlie C.L. Wang', 'Yeung Yam']","In this paper, we present a new computer-controlled weaving technology that enables the fabrication of woven structures in the shape of given 3D surfaces by using threads in non-traditional materials with high bending-stiffness, allowing for multiple applications with the resultant woven fabrics. A new weaving machine and a new manufacturing process are developed to realize the function of 3D surface weaving by the principle of short-row shaping. A computational solution is investigated to convert input 3D freeform surfaces into the corresponding weaving operations (indicated as W-code) to guide the operation of this system. A variety of examples using cotton threads, conductive threads and optical fibres are fabricated by our prototype system to demonstrate its functionality."
205,When ControlNet Meets Inexplicit Masks: A Case Study of ControlNet on its Contour-following Ability,Computer Vision and Pattern Recognition,"['Wenjie Xuan', 'Yufei Xu', 'Shanshan Zhao', 'Chaoyue Wang', 'Juhua Liu', 'Bo Du', 'Dacheng Tao']","ControlNet excels at creating content that closely matches precise contours in user-provided masks. However, when these masks contain noise, as a frequent occurrence with non-expert users, the output would include unwanted artifacts. This paper first highlights the crucial role of controlling the impact of these inexplicit masks with diverse deterioration levels through in-depth analysis. Subsequently, to enhance controllability with inexplicit masks, an advanced Shape-aware ControlNet consisting of a deterioration estimator and a shape-prior modulation block is devised. The deterioration estimator assesses the deterioration factor of the provided masks. Then this factor is utilized in the modulation block to adaptively modulate the model's contour-following ability, which helps it dismiss the noise part in the inexplicit masks. Extensive experiments prove its effectiveness in encouraging ControlNet to interpret inaccurate spatial conditions robustly rather than blindly following the given contours. We showcase application scenarios like modifying shape priors and composable shape-controllable generation. Codes are soon available."
206,Polyamorous Scheduling,Data Structures and Algorithms,"['Leszek Gąsieniec', 'Benjamin Smith', 'Sebastian Wild']","Finding schedules for pairwise meetings between the members of a complex social group without creating interpersonal conflict is challenging, especially when different relationships have different needs. We formally define and study the underlying optimisation problem: Polyamorous Scheduling.
In Polyamorous Scheduling, we are given an edge-weighted graph and try to find a periodic schedule of matchings in this graph such that the maximal weighted waiting time between consecutive occurrences of the same edge is minimised. We show that the problem is NP-hard and that there is no efficient approximation algorithm with a better ratio than 13/12 unless P = NP. On the positive side, we obtain an $O(\log n)$-approximation algorithm. We also define a generalisation of density from the Pinwheel Scheduling Problem, ""poly density"", and ask whether there exists a poly density threshold similar to the 5/6-density threshold for Pinwheel Scheduling [Kawamura, STOC 2024]. Polyamorous Scheduling is a natural generalisation of Pinwheel Scheduling with respect to its optimisation variant, Bamboo Garden Trimming.
Our work contributes the first nontrivial hardness-of-approximation reduction for any periodic scheduling problem, and opens up numerous avenues for further study of Polyamorous Scheduling."
207,Attacking Delay-based PUFs with Minimal Adversary Model,Cryptography and Security,"['Hongming Fei', 'Owen Millwood', 'Prosanta Gope', 'Jack Miskelly', 'Biplab Sikdar']","Physically Unclonable Functions (PUFs) provide a streamlined solution for lightweight device authentication. Delay-based Arbiter PUFs, with their ease of implementation and vast challenge space, have received significant attention; however, they are not immune to modelling attacks that exploit correlations between their inputs and outputs. Research is therefore polarized between developing modelling-resistant PUFs and devising machine learning attacks against them. This dichotomy often results in exaggerated concerns and overconfidence in PUF security, primarily because there lacks a universal tool to gauge a PUF's security. In many scenarios, attacks require additional information, such as PUF type or configuration parameters. Alarmingly, new PUFs are often branded `secure' if they lack a specific attack model upon introduction. To impartially assess the security of delay-based PUFs, we present a generic framework featuring a Mixture-of-PUF-Experts (MoPE) structure for mounting attacks on various PUFs with minimal adversarial knowledge, which provides a way to compare their performance fairly and impartially. We demonstrate the capability of our model to attack different PUF types, including the first successful attack on Heterogeneous Feed-Forward PUFs using only a reasonable amount of challenges and responses. We propose an extension version of our model, a Multi-gate Mixture-of-PUF-Experts (MMoPE) structure, facilitating multi-task learning across diverse PUFs to recognise commonalities across PUF designs. This allows a streamlining of training periods for attacking multiple PUFs simultaneously. We conclude by showcasing the potent performance of MoPE and MMoPE across a spectrum of PUF types, employing simulated, real-world unbiased, and biased data sets for analysis."
208,LUCID: LLM-Generated Utterances for Complex and Interesting Dialogues,Computation and Language,"['Joe Stacey', 'Jianpeng Cheng', 'John Torr', 'Tristan Guigue', 'Joris Driesen', 'Alexandru Coca', 'Mark Gaynor', 'Anders Johannsen']","Virtual assistants are poised to take a dramatic leap forward in terms of their dialogue capabilities, spurred by recent advances in transformer-based Large Language Models (LLMs). Yet a major bottleneck to achieving genuinely transformative task-oriented dialogue capabilities remains the scarcity of high quality and linguistically sophisticated data. Existing datasets, while impressive in scale, have limited domain coverage and contain few genuinely challenging conversational phenomena; those which are present are typically unlabelled, making it difficult to assess the strengths and weaknesses of models without time-consuming and costly human evaluation. Moreover, creating high quality dialogue data has until now required considerable human input, limiting both the scale of these datasets and the ability to rapidly bootstrap data for a new target domain. We aim to overcome these issues with LUCID, a modularised and highly automated LLM-driven data generation system that produces realistic, diverse and challenging dialogues. We use LUCID to generate a seed dataset of 4,277 multi-domain, multi-intent conversations across 100 intents to demonstrate its capabilities. The generated conversations include a wide range of challenging phenomena and diverse user behaviour, conveniently identifiable via a set of turn-level tags. Finally, we provide separate test sets for seen and unseen intents, allowing for convenient out-of-distribution evaluation. We release both the data generation code and the dataset itself."
209,Deformable One-shot Face Stylization via DINO Semantic Guidance,Computer Vision and Pattern Recognition,"['Yang Zhou', 'Zichong Chen', 'Hui Huang']","This paper addresses the complex issue of one-shot face stylization, focusing on the simultaneous consideration of appearance and structure, where previous methods have fallen short. We explore deformation-aware face stylization that diverges from traditional single-image style reference, opting for a real-style image pair instead. The cornerstone of our method is the utilization of a self-supervised vision transformer, specifically DINO-ViT, to establish a robust and consistent facial structure representation across both real and style domains. Our stylization process begins by adapting the StyleGAN generator to be deformation-aware through the integration of spatial transformers (STN). We then introduce two innovative constraints for generator fine-tuning under the guidance of DINO semantics: i) a directional deformation loss that regulates directional vectors in DINO space, and ii) a relative structural consistency constraint based on DINO token self-similarities, ensuring diverse generation. Additionally, style-mixing is employed to align the color generation with the reference, minimizing inconsistent correspondences. This framework delivers enhanced deformability for general one-shot face stylization, achieving notable efficiency with a fine-tuning duration of approximately 10 minutes. Extensive qualitative and quantitative comparisons demonstrate our superiority over state-of-the-art one-shot face stylization methods. Code is available at \url{this https URL}."
210,A Survey on Self-healing Software System,Software Engineering,['Zahra Yazdanparast'],"With the increasing complexity of software systems, it becomes very difficult to install, configure, adjust, and maintain them. As systems become more interconnected and diverse, system architects are less able to predict and design the interaction between components, deferring the handling of these issues to runtime. One of the important problems that occur during execution is system failures, which increase the need for self-healing systems. The main purpose of self-healing is to have an automatic system that can heal itself without human intervention. This system has predefined actions and procedures that are suitable for recovering the system from different failure modes. In this study, different self-healing methods are categorized and a summary of them is presented."
211,Shorts vs. Regular Videos on YouTube: A Comparative Analysis of User Engagement and Content Creation Trends,Social and Information Networks,"['Caroline Violot', 'Tuğrulcan Elmas', 'Igor Bilogrevic', 'Mathias Humbert']","YouTube introduced the Shorts video format in 2021, allowing users to upload short videos that are prominently displayed on its website and app. Despite having such a large visual footprint, there are no studies to date that have looked at the impact Shorts introduction had on the production and consumption of content on YouTube. This paper presents the first comparative analysis of YouTube Shorts versus regular videos with respect to user engagement (i.e., views, likes, and comments), content creation frequency and video categories. We collected a dataset containing information about 70k channels that posted at least one Short, and we analyzed the metadata of all the videos (9.9M Shorts and 6.9M regular videos) they uploaded between January 2021 and December 2022, spanning a two-year period including the introduction of Shorts. Our longitudinal analysis shows that content creators consistently increased the frequency of Shorts production over this period, especially for newly-created channels, which surpassed that of regular videos. We also observe that Shorts target mostly entertainment categories, while regular videos cover a wide variety of categories. In general, Shorts attract more views and likes per view than regular videos, but attract less comments per view. However, Shorts do not outperform regular videos in the education and political categories as much as they do in other categories. Our study contributes to understanding social media dynamics, to quantifying the spread of short-form content, and to motivating future research on its impact on society."
212,An Ordinal Diffusion Model for Generating Medical Images with Different Severity Levels,Computer Vision and Pattern Recognition,"['Shumpei Takezaki', 'Seiichi Uchida']","Diffusion models have recently been used for medical image generation because of their high image quality. In this study, we focus on generating medical images with ordinal classes, which have ordinal relationships, such as severity levels. We propose an Ordinal Diffusion Model (ODM) that controls the ordinal relationships of the estimated noise images among the classes. Our model was evaluated experimentally by generating retinal and endoscopic images of multiple severity classes. ODM achieved higher performance than conventional generative models by generating realistic images, especially in high-severity classes with fewer training samples."
213,Parallel Hyperparameter Optimization Of Spiking Neural Network,Neural and Evolutionary Computing,"['Thomas Firmin', 'Pierre Boulet', 'El-Ghazali Talbi']","Spiking Neural Networks (SNN). SNNs are based on a more biologically inspired approach than usual artificial neural networks. Such models are characterized by complex dynamics between neurons and spikes. These are very sensitive to the hyperparameters, making their optimization challenging. To tackle hyperparameter optimization of SNNs, we initially extended the signal loss issue of SNNs to what we call silent networks. These networks fail to emit enough spikes at their outputs due to mistuned hyperparameters or architecture. Generally, search spaces are heavily restrained, sometimes even discretized, to prevent the sampling of such networks. By defining an early stopping criterion detecting silent networks and by designing specific constraints, we were able to instantiate larger and more flexible search spaces. We applied a constrained Bayesian optimization technique, which was asynchronously parallelized, as the evaluation time of a SNN is highly stochastic. Large-scale experiments were carried-out on a multi-GPU Petascale architecture. By leveraging silent networks, results show an acceleration of the search, while maintaining good performances of both the optimization algorithm and the best solution obtained. We were able to apply our methodology to two popular training algorithms, known as spike timing dependent plasticity and surrogate gradient. Early detection allowed us to prevent worthless and costly computation, directing the search toward promising hyperparameter combinations. Our methodology could be applied to multi-objective problems, where the spiking activity is often minimized to reduce the energy consumption. In this scenario, it becomes essential to find the delicate frontier between low-spiking and silent networks. Finally, our approach may have implications for neural architecture search, particularly in defining suitable spiking architectures."
