,Title,Subjects,Authors,Abstracts
74,Popularity and Perfectness in One-sided Matching Markets with Capacities,Computer Science and Game Theory,['Gergely Csáji'],"We consider many-to-one matching problems, where one side corresponds to applicants who have preferences and the other side to houses who do not have preferences. We consider two different types of this market: one, where the applicants have capacities, and one where the houses do. First, we answer an open question by Manlove and Sng (2006) (partly solved Paluch (2014) for preferences with ties), that is, we show that deciding if a popular matching exists in the house allocation problem, where agents have capacities is NP-hard for previously studied versions of popularity. Then, we consider the other version, where the houses have capacities. We study how to optimally increase the capacities of the houses to obtain a matching satisfying multiple optimality criteria, like popularity, Pareto-optimality and perfectness. We consider two common optimality criteria, one aiming to minimize the sum of capacity increases of all houses and the other aiming to minimize the maximum capacity increase of any school. We obtain a complete picture in terms of computational complexity and some algorithms."
75,Discrete minimizers of the interaction energy in collective behavior: a brief numerical and analytic review,Mathematics > Numerical Analysis,"['José A. Cañizo', 'Alejandro Ramos-Lora']","We consider minimizers of the N-particle interaction potential energy and briefly review numerical methods used to calculate them. We consider simple pair potentials which are attractive at short distances and repulsive at long distances, focusing on examples which are sums of two powers. The range of powers we look at includes the well-known case of the Lennard-Jones potential, but we are also interested in less singular potentials which are relevant in collective behavior models. We report on results using the software GMIN developed by Wales and collaborators for problems in chemistry. For all cases, this algorithm gives good candidates for the minimizers for relatively low values of the particle number N. This is well-known for potentials similar to Lennard-Jones, but not for the range which is of interest in collective behavior. Standard minimization procedures have been used in the literature in this range, but they are likely to yield stationary states which are not minimizers. We illustrate numerically some properties of the minimizers in 2D, such as lattice structure, Wulff shapes, and the continuous large-N limit for locally integrable (that is, less singular) potentials."
76,Rethinking Few-shot 3D Point Cloud Semantic Segmentation,Computer Vision and Pattern Recognition,"['Zhaochong An', 'Guolei Sun', 'Yun Liu', 'Fayao Liu', 'Zongwei Wu', 'Dan Wang', 'Luc Van Gool', 'Serge Belongie']","This paper revisits few-shot 3D point cloud semantic segmentation (FS-PCS), with a focus on two significant issues in the state-of-the-art: foreground leakage and sparse point distribution. The former arises from non-uniform point sampling, allowing models to distinguish the density disparities between foreground and background for easier segmentation. The latter results from sampling only 2,048 points, limiting semantic information and deviating from the real-world practice. To address these issues, we introduce a standardized FS-PCS setting, upon which a new benchmark is built. Moreover, we propose a novel FS-PCS model. While previous methods are based on feature optimization by mainly refining support features to enhance prototypes, our method is based on correlation optimization, referred to as Correlation Optimization Segmentation (COSeg). Specifically, we compute Class-specific Multi-prototypical Correlation (CMC) for each query point, representing its correlations to category prototypes. Then, we propose the Hyper Correlation Augmentation (HCA) module to enhance CMC. Furthermore, tackling the inherent property of few-shot training to incur base susceptibility for models, we propose to learn non-parametric prototypes for the base classes during training. The learned base prototypes are used to calibrate correlations for the background class through a Base Prototypes Calibration (BPC) module. Experiments on popular datasets demonstrate the superiority of COSeg over existing methods. The code is available at: this https URL"
77,Learning Causal Features for Incremental Object Detection,Computer Vision and Pattern Recognition,"['Zhenwei He', 'Lei Zhang']","Object detection limits its recognizable categories during the training phase, in which it can not cover all objects of interest for users. To satisfy the practical necessity, the incremental learning ability of the detector becomes a critical factor for real-world applications. Unfortunately, neural networks unavoidably meet catastrophic forgetting problem when it is implemented on a new task. To this end, many incremental object detection models preserve the knowledge of previous tasks by replaying samples or distillation from previous models. However, they ignore an important factor that the performance of the model mostly depends on its feature. These models try to rouse the memory of the neural network with previous samples but not to prevent forgetting. To this end, in this paper, we propose an incremental causal object detection (ICOD) model by learning causal features, which can adapt to more tasks. Traditional object detection models, unavoidably depend on the data-bias or data-specific features to get the detection results, which can not adapt to the new task. When the model meets the requirements of incremental learning, the data-bias information is not beneficial to the new task, and the incremental learning may eliminate these features and lead to forgetting. To this end, our ICOD is introduced to learn the causal features, rather than the data-bias features when training the detector. Thus, when the model is implemented to a new task, the causal features of the old task can aid the incremental learning process to alleviate the catastrophic forgetting problem. We conduct our model on several experiments, which shows a causal feature without data-bias can make the model adapt to new tasks better. \keywords{Object detection, incremental learning, causal feature."
78,Hercules: Heterogeneous Requirements Congestion Control Protocol,Networking and Internet Architecture,"['Neta Rozen-Schiff', 'Itzcak Pechtalt', 'Amit Navon', 'Leon Bruckman']","Today's networks are struggling to scale and satisfy the high number and high variety of co-existing network requirements. While existing congestion control (CC) protocols are designed to handle strict classification of network flows into one or few priorities, a more granular and dynamic congestion control is needed.
In this paper we present Hercules, a novel CC protocol based on an online learning approach, which supports unbounded and continues requirements space. We implemented Hercules as a QUIC module and we show, through analytical analysis and real-world experiments, that it provides between $50\%-250\%$ higher QoS for co-existing diverse network flows and outperforms state-of-the-art CC protocols, even under high network congestion."
79,Improving Explicit Spatial Relationships in Text-to-Image Generation through an Automatically Derived Dataset,Computer Vision and Pattern Recognition,"['Ander Salaberria', 'Gorka Azkune', 'Oier Lopez de Lacalle', 'Aitor Soroa', 'Eneko Agirre', 'Frank Keller']","Existing work has observed that current text-to-image systems do not accurately reflect explicit spatial relations between objects such as 'left of' or 'below'. We hypothesize that this is because explicit spatial relations rarely appear in the image captions used to train these models. We propose an automatic method that, given existing images, generates synthetic captions that contain 14 explicit spatial relations. We introduce the Spatial Relation for Generation (SR4G) dataset, which contains 9.9 millions image-caption pairs for training, and more than 60 thousand captions for evaluation. In order to test generalization we also provide an 'unseen' split, where the set of objects in the train and test captions are disjoint. SR4G is the first dataset that can be used to spatially fine-tune text-to-image systems. We show that fine-tuning two different Stable Diffusion models (denoted as SD$_{SR4G}$) yields up to 9 points improvements in the VISOR metric. The improvement holds in the 'unseen' split, showing that SD$_{SR4G}$ is able to generalize to unseen objects. SD$_{SR4G}$ improves the state-of-the-art with fewer parameters, and avoids complex architectures. Our analysis shows that improvement is consistent for all relations. The dataset and the code will be publicly available."
80,Open Assistant Toolkit -- version 2,Information Retrieval,"['Sophie Fischer', 'Federico Rossetto', 'Carlos Gemmell', 'Andrew Ramsay', 'Iain Mackie', 'Philip Zubel', 'Niklas Tecklenburg', 'Jeffrey Dalton']","We present the second version of the Open Assistant Toolkit (OAT-v2), an open-source task-oriented conversational system for composing generative neural models. OAT-v2 is a scalable and flexible assistant platform supporting multiple domains and modalities of user interaction. It splits processing a user utterance into modular system components, including submodules such as action code generation, multimodal content retrieval, and knowledge-augmented response generation. Developed over multiple years of the Alexa TaskBot challenge, OAT-v2 is a proven system that enables scalable and robust experimentation in experimental and real-world deployment. OAT-v2 provides open models and software for research and commercial applications to enable the future of multimodal virtual assistants across diverse applications and types of rich interaction."
81,Decentralized Uncoded Storage Elastic Computing with Heterogeneous Computation Speeds,Information Theory,"['Wenbo Huang', 'Xudong You', 'Kai Wan', 'Robert Caiming Qiu', 'Mingyue Ji']","Elasticity plays an important role in modern cloud computing systems. Elastic computing allows virtual machines (i.e., computing nodes) to be preempted when high-priority jobs arise, and also allows new virtual machines to participate in the computation. In 2018, Yang et al. introduced Coded Storage Elastic Computing (CSEC) to address the elasticity using coding technology, with lower storage and computation load requirements. However, CSEC is limited to certain types of computations (e.g., linear) due to the coded data storage based on linear coding. Then Centralized Uncoded Storage Elastic Computing (CUSEC) with heterogeneous computation speeds was proposed, which directly copies parts of data into the virtual machines. In all existing works in elastic computing, the storage assignment is centralized, meaning that the number and identity of all virtual machines possible used in the whole computation process are known during the storage assignment. In this paper, we consider Decentralized Uncoded Storage Elastic Computing (DUSEC) with heterogeneous computation speeds, where any available virtual machine can join the computation which is not predicted and thus coordination among different virtual machines' storage assignments is not allowed. Under a decentralized storage assignment originally proposed in coded caching by Maddah-Ali and Niesen, we propose a computing scheme with closed-form optimal computation time. We also run experiments over MNIST dataset with Softmax regression model through the Tencent cloud platform, and the experiment results demonstrate that the proposed DUSEC system approaches the state-of-art best storage assignment in the CUSEC system in computation time."
82,Generalized User Representations for Transfer Learning,Information Retrieval,"['Ghazal Fazelnia', 'Sanket Gupta', 'Claire Keum', 'Mark Koh', 'Ian Anderson', 'Mounia Lalmas']","We present a novel framework for user representation in large-scale recommender systems, aiming at effectively representing diverse user taste in a generalized manner. Our approach employs a two-stage methodology combining representation learning and transfer learning. The representation learning model uses an autoencoder that compresses various user features into a representation space. In the second stage, downstream task-specific models leverage user representations via transfer learning instead of curating user features individually. We further augment this methodology on the representation's input features to increase flexibility and enable reaction to user events, including new user experiences, in Near-Real Time. Additionally, we propose a novel solution to manage deployment of this framework in production models, allowing downstream models to work independently. We validate the performance of our framework through rigorous offline and online experiments within a large-scale system, showcasing its remarkable efficacy across multiple evaluation tasks. Finally, we show how the proposed framework can significantly reduce infrastructure costs compared to alternative approaches."
83,To Trust or Distrust Trust Measures: Validating Questionnaires for Trust in AI,Human-Computer Interaction,"['Nicolas Scharowski', 'Sebastian A. C. Perrig', 'Lena Fanya Aeschbach', 'Nick von Felten', 'Klaus Opwis', 'Philipp Wintersberger', 'Florian Brühlmann']","Despite the importance of trust in human-AI interactions, researchers must adopt questionnaires from other disciplines that lack validation in the AI context. Motivated by the need for reliable and valid measures, we investigated the psychometric quality of two trust questionnaires, the Trust between People and Automation scale (TPA) by Jian et al. (2000) and the Trust Scale for the AI Context (TAI) by Hoffman et al. (2023). In a pre-registered online experiment (N = 1485), participants observed interactions with trustworthy and untrustworthy AI (autonomous vehicle and chatbot). Results support the psychometric quality of the TAI while revealing opportunities to improve the TPA, which we outline in our recommendations for using the two questionnaires. Furthermore, our findings provide additional empirical evidence of trust and distrust as two distinct constructs that may coexist independently. Building on our findings, we highlight the opportunities and added value of measuring both trust and distrust in human-AI research and advocate for further work on both constructs."
84,NeuPIMs: A NPU-PIM Heterogeneous Acceleration for Batched Inference of Large Language Model,Hardware Architecture,"['Guseul Heo', 'Sangyeop Lee', 'Jaehong Cho', 'Hyunmin Choi', 'Sanghyeon Lee', 'Hyungkyu Ham', 'Gwangsun Kim', 'Divya Mahajan', 'Jongse Park']","Modern transformer-based Large Language Models (LLMs) are constructed with a series of decoder blocks. Each block comprises three key components: (1) QKV generation, (2) multi-head attention, and (3) feed-forward networks. In batched processing, QKV generation and feed-forward networks involve compute-intensive matrix-matrix multiplications (GEMM), while multi-head attention requires bandwidth-heavy matrix-vector multiplications (GEMV). Machine learning accelerators like TPUs or NPUs are proficient in handling GEMM but are less efficient for GEMV computations. Conversely, Processing-in-Memory (PIM) technology is tailored for efficient GEMV computation, while it lacks the computational power to effectively handle GEMM. Inspired by this insight, we propose NeuPIMs, a heterogeneous accelerator-based system that jointly exploits a conventional GEMM-focused NPU and GEMV-optimized PIM devices. The main challenge in efficiently integrating NPU and PIM lies in enabling concurrent operations on both platforms, each addressing a specific kernel type. First, existing PIMs typically operate in a ""blocked"" mode, allowing only either NPU or PIM to be active at any given time. Second, the inherent dependencies between GEMM and GEMV in LLMs restrict their parallel processing. To tackle these challenges, NeuPIMs is equipped with dual row buffers in each bank, facilitating the simultaneous management of memory read/write operations and PIM commands. Further, NeuPIMs employs a runtime sub-batch interleaving technique to maximize concurrent execution, leveraging batch parallelism to allow two independent sub-batches to be pipelined within a single NeuPIMs node. Our evaluation demonstrates that compared to an NPU-only approach and a naïve NPU-PIM integrated system, NeuPIMs achieves 2.3$\times$ and 1.6$\times$ throughput improvement, respectively."
85,SINDy vs Hard Nonlinearities and Hidden Dynamics: a Benchmarking Study,Electrical Engineering and Systems Science > Systems and Control,"['Aurelio Raffa Ugolini', 'Valentina Breschi', 'Andrea Manzoni', 'Mara Tanelli']","In this work we analyze the effectiveness of the Sparse Identification of Nonlinear Dynamics (SINDy) technique on three benchmark datasets for nonlinear identification, to provide a better understanding of its suitability when tackling real dynamical systems. While SINDy can be an appealing strategy for pursuing physics-based learning, our analysis highlights difficulties in dealing with unobserved states and non-smooth dynamics. Due to the ubiquity of these features in real systems in general, and control applications in particular, we complement our analysis with hands-on approaches to tackle these issues in order to exploit SINDy also in these challenging contexts."
86,Beyond Single-Model Views for Deep Learning: Optimization versus Generalizability of Stochastic Optimization Algorithms,Machine Learning,"['Toki Tahmid Inan', 'Mingrui Liu', 'Amarda Shehu']","Despite an extensive body of literature on deep learning optimization, our current understanding of what makes an optimization algorithm effective is fragmented. In particular, we do not understand well whether enhanced optimization translates to improved generalizability. Current research overlooks the inherent stochastic nature of stochastic gradient descent (SGD) and its variants, resulting in a lack of comprehensive benchmarking and insight into their statistical performance. This paper aims to address this gap by adopting a novel approach. Rather than solely evaluating the endpoint of individual optimization trajectories, we draw from an ensemble of trajectories to estimate the stationary distribution of stochastic optimizers. Our investigation encompasses a wide array of techniques, including SGD and its variants, flat-minima optimizers, and new algorithms we propose under the Basin Hopping framework. Through our evaluation, which encompasses synthetic functions with known minima and real-world problems in computer vision and natural language processing, we emphasize fair benchmarking under a statistical framework, comparing stationary distributions and establishing statistical significance. Our study uncovers several key findings regarding the relationship between training loss and hold-out accuracy, as well as the comparable performance of SGD, noise-enabled variants, and novel optimizers utilizing the BH framework. Notably, these algorithms demonstrate performance on par with flat-minima optimizers like SAM, albeit with half the gradient evaluations. We anticipate that our work will catalyze further exploration in deep learning optimization, encouraging a shift away from single-model approaches towards methodologies that acknowledge and leverage the stochastic nature of optimizers."
87,IDTrust: Deep Identity Document Quality Detection with Bandpass Filtering,Computer Vision and Pattern Recognition,"['Musab Al-Ghadi', 'Joris Voerman', 'Souhail Bakkali', 'Mickaël Coustaty', 'Nicolas Sidere', 'Xavier St-Georges']","The increasing use of digital technologies and mobile-based registration procedures highlights the vital role of personal identity documents (IDs) in verifying users and safeguarding sensitive information. However, the rise in counterfeit ID production poses a significant challenge, necessitating the development of reliable and efficient automated verification methods. This paper introduces IDTrust, a deep-learning framework for assessing the quality of IDs. IDTrust is a system that enhances the quality of identification documents by using a deep learning-based approach. This method eliminates the need for relying on original document patterns for quality checks and pre-processing steps for alignment. As a result, it offers significant improvements in terms of dataset applicability. By utilizing a bandpass filtering-based method, the system aims to effectively detect and differentiate ID quality. Comprehensive experiments on the MIDV-2020 and L3i-ID datasets identify optimal parameters, significantly improving discrimination performance and effectively distinguishing between original and scanned ID documents."
88,Computational homogenization for aerogel-like polydisperse open-porous materials using neural network--based surrogate models on the microscale,Mathematics > Numerical Analysis,"['Axel Klawonn', 'Martin Lanser', 'Lucas Mager', 'Ameya Rege']","The morphology of nanostructured materials exhibiting a polydisperse porous space, such as aerogels, is very open porous and fine grained. Therefore, a simulation of the deformation of a large aerogel structure resolving the nanostructure would be extremely expensive. Thus, multi-scale or homogenization approaches have to be considered. Here, a computational scale bridging approach based on the FE$^2$ method is suggested, where the macroscopic scale is discretized using finite elements while the microstructure of the open-porous material is resolved as a network of Euler-Bernoulli beams. Here, the beam frame based RVEs (representative volume elements) have pores whose size distribution follows the measured values for a specific material. This is a well-known approach to model aerogel structures. For the computational homogenization, an approach to average the first Piola-Kirchhoff stresses in a beam frame by neglecting rotational moments is suggested. To further overcome the computationally most expensive part in the homogenization method, that is, solving the RVEs and averaging their stress fields, a surrogate model is introduced based on neural networks. The networks input is the localized deformation gradient on the macroscopic scale and its output is the averaged stress for the specific material. It is trained on data generated by the beam frame based approach. The effiency and robustness of both homogenization approaches is shown numerically, the approximation properties of the surrogate model is verified for different macroscopic problems and discretizations. Different (Quasi-)Newton solvers are considered on the macroscopic scale and compared with respect to their convergence properties."
89,Rethinking cluster-conditioned diffusion models,Computer Vision and Pattern Recognition,"['Nikolas Adaloglou', 'Tim Kaiser', 'Felix Michels', 'Markus Kollmann']","We present a comprehensive experimental study on image-level conditioning for diffusion models using cluster assignments. We elucidate how individual components regarding image clustering impact image synthesis across three datasets. By combining recent advancements from image clustering and diffusion models, we show that, given the optimal cluster granularity with respect to image synthesis (visual groups), cluster-conditioning can achieve state-of-the-art FID (i.e. 1.67, 2.17 on CIFAR10 and CIFAR100 respectively), while attaining a strong training sample efficiency. Finally, we propose a novel method to derive an upper cluster bound that reduces the search space of the visual groups using solely feature-based clustering. Unlike existing approaches, we find no significant connection between clustering and cluster-conditional image generation. The code and cluster assignments will be released."
90,Flatten Long-Range Loss Landscapes for Cross-Domain Few-Shot Learning,Computer Vision and Pattern Recognition,"['Yixiong Zou', 'Yicong Liu', 'Yiman Hu', 'Yuhua Li', 'Ruixuan Li']","Cross-domain few-shot learning (CDFSL) aims to acquire knowledge from limited training data in the target domain by leveraging prior knowledge transferred from source domains with abundant training samples. CDFSL faces challenges in transferring knowledge across dissimilar domains and fine-tuning models with limited training data. To address these challenges, we initially extend the analysis of loss landscapes from the parameter space to the representation space, which allows us to simultaneously interpret the transferring and fine-tuning difficulties of CDFSL models. We observe that sharp minima in the loss landscapes of the representation space result in representations that are hard to transfer and fine-tune. Moreover, existing flatness-based methods have limited generalization ability due to their short-range flatness. To enhance the transferability and facilitate fine-tuning, we introduce a simple yet effective approach to achieve long-range flattening of the minima in the loss landscape. This approach considers representations that are differently normalized as minima in the loss landscape and flattens the high-loss region in the middle by randomly sampling interpolated representations. We implement this method as a new normalization layer that replaces the original one in both CNNs and ViTs. This layer is simple and lightweight, introducing only a minimal number of additional parameters. Experimental results on 8 datasets demonstrate that our approach outperforms state-of-the-art methods in terms of average accuracy. Moreover, our method achieves performance improvements of up to 9\% compared to the current best approaches on individual datasets. Our code will be released."
