,Title,Subjects,Authors,Abstracts
0,Point Could Mamba: Point Cloud Learning via State Space Model,Computer Vision and Pattern Recognition,"['Tao Zhang', 'Xiangtai Li', 'Haobo Yuan', 'Shunping Ji', 'Shuicheng Yan']","In this work, for the first time, we demonstrate that Mamba-based point cloud methods can outperform point-based methods. Mamba exhibits strong global modeling capabilities and linear computational complexity, making it highly attractive for point cloud analysis. To enable more effective processing of 3-D point cloud data by Mamba, we propose a novel Consistent Traverse Serialization to convert point clouds into 1-D point sequences while ensuring that neighboring points in the sequence are also spatially adjacent. Consistent Traverse Serialization yields six variants by permuting the order of x, y, and z coordinates, and the synergistic use of these variants aids Mamba in comprehensively observing point cloud data. Furthermore, to assist Mamba in handling point sequences with different orders more effectively, we introduce point prompts to inform Mamba of the sequence's arrangement rules. Finally, we propose positional encoding based on spatial coordinate mapping to inject positional information into point cloud sequences better. Based on these improvements, we construct a point cloud network named Point Cloud Mamba, which combines local and global modeling. Point Cloud Mamba surpasses the SOTA point-based method PointNeXt and achieves new SOTA performance on the ScanObjectNN, ModelNet40, and ShapeNetPart datasets."
1,Mitigating Reversal Curse via Semantic-aware Permutation Training,Computation and Language,"['Qingyan Guo', 'Rui Wang', 'Junliang Guo', 'Xu Tan', 'Jiang Bian', 'Yujiu Yang']","While large language models (LLMs) have achieved impressive performance across diverse tasks, recent studies showcase that causal LLMs suffer from the ""reversal curse"". It is a typical example that the model knows ""A's father is B"", but is unable to reason ""B's child is A"". This limitation poses a challenge to the advancement of artificial general intelligence (AGI), as it suggests a gap in the models' ability to comprehend and apply bidirectional reasoning. In this paper, we first conduct substantial evaluation and identify that the root cause of the reversal curse lies in the different word order between the training and inference stage, namely, the poor ability of causal language models to predict antecedent words within the training data. Accordingly, permutation on the training data is considered as a potential solution, since this can make the model predict antecedent words or tokens. However, previous permutation methods may disrupt complete phrases or entities, thereby posing challenges for the model to comprehend and learn from training data. To address this issue, we propose Semantic-aware Permutation Training (SPT), which addresses this issue by segmenting the training sentences into semantic units (i.e., entities or phrases) with an assistant language model and permuting these units before feeding into the model. Extensive experiments demonstrate that SPT effectively mitigates the reversal curse since the performance on reversed questions approximates that on the forward ones, and significantly advances the performance of existing works."
2,An Experimental Study of Low-Latency Video Streaming over 5G,Multimedia,"['Imran Khan', 'Tuyen X. Tran', 'Matti Hiltunen', 'Theodore Karagioules', 'Dimitrios Koutsonikolas']","Low-latency video streaming over 5G has become rapidly popular over the last few years due to its increased usage in hosting virtual events, online education, webinars, and all-hands meetings. Our work aims to address the absence of studies that reveal the real-world behavior of low-latency video streaming. To that end, we provide an experimental methodology and measurements, collected in a US metropolitan area over a commercial 5G network, that correlates application-level QoE and lower-layer metrics on the devices, such as RSRP, RSRQ, handover records, etc., under both static and mobility scenarios. We find that RAN-side information, which is readily available on every cellular device, has the potential to enhance throughput estimation modules of video streaming clients, ultimately making low-latency streaming more resilient against network perturbations and handover events."
3,AtP*: An efficient and scalable method for localizing LLM behaviour to components,Machine Learning,"['János Kramár', 'Tom Lieberum', 'Rohin Shah', 'Neel Nanda']","Activation Patching is a method of directly computing causal attributions of behavior to model components. However, applying it exhaustively requires a sweep with cost scaling linearly in the number of model components, which can be prohibitively expensive for SoTA Large Language Models (LLMs). We investigate Attribution Patching (AtP), a fast gradient-based approximation to Activation Patching and find two classes of failure modes of AtP which lead to significant false negatives. We propose a variant of AtP called AtP*, with two changes to address these failure modes while retaining scalability. We present the first systematic study of AtP and alternative methods for faster activation patching and show that AtP significantly outperforms all other investigated methods, with AtP* providing further significant improvement. Finally, we provide a method to bound the probability of remaining false negatives of AtP* estimates."
4,Neural Acceleration of Incomplete Cholesky Preconditioners,"Distributed, Parallel, and Cluster Computing","['Joshua Dennis Booth', 'Hongyang Sun', 'Trevor Garnett']","The solution of a sparse system of linear equations is ubiquitous in scientific applications. Iterative methods, such as the Preconditioned Conjugate Gradient method (PCG), are normally chosen over direct methods due to memory and computational complexity constraints. However, the efficiency of these methods depends on the preconditioner utilized. The development of the preconditioner normally requires some insight into the sparse linear system and the desired trade-off of generating the preconditioner and the reduction in the number of iterations. Incomplete factorization methods tend to be black box methods to generate these preconditioners but may fail for a number of reasons. These reasons include numerical issues that require searching for adequate scaling, shifting, and fill-in while utilizing a difficult to parallelize algorithm. With a move towards heterogeneous computing, many sparse applications find GPUs that are optimized for dense tensor applications like training neural networks being underutilized. In this work, we demonstrate that a simple artificial neural network trained either at compile time or in parallel to the running application on a GPU can provide an incomplete sparse Cholesky factorization that can be used as a preconditioner. This generated preconditioner is as good or better in terms of reduction of iterations than the one found using multiple preconditioning techniques such as scaling and shifting. Moreover, the generated method also works and never fails to produce a preconditioner that does not reduce the iteration count."
5,"Dialect prejudice predicts AI decisions about people's character, employability, and criminality",Computation and Language,"['Valentin Hofmann', 'Pratyusha Ria Kalluri', 'Dan Jurafsky', 'Sharese King']","Hundreds of millions of people now interact with language models, with uses ranging from serving as a writing aid to informing hiring decisions. Yet these language models are known to perpetuate systematic racial prejudices, making their judgments biased in problematic ways about groups like African Americans. While prior research has focused on overt racism in language models, social scientists have argued that racism with a more subtle character has developed over time. It is unknown whether this covert racism manifests in language models. Here, we demonstrate that language models embody covert racism in the form of dialect prejudice: we extend research showing that Americans hold raciolinguistic stereotypes about speakers of African American English and find that language models have the same prejudice, exhibiting covert stereotypes that are more negative than any human stereotypes about African Americans ever experimentally recorded, although closest to the ones from before the civil rights movement. By contrast, the language models' overt stereotypes about African Americans are much more positive. We demonstrate that dialect prejudice has the potential for harmful consequences by asking language models to make hypothetical decisions about people, based only on how they speak. Language models are more likely to suggest that speakers of African American English be assigned less prestigious jobs, be convicted of crimes, and be sentenced to death. Finally, we show that existing methods for alleviating racial bias in language models such as human feedback training do not mitigate the dialect prejudice, but can exacerbate the discrepancy between covert and overt stereotypes, by teaching language models to superficially conceal the racism that they maintain on a deeper level. Our findings have far-reaching implications for the fair and safe employment of language technology."
6,Happy Ending: An Empty Hexagon in Every Set of 30 Points,Computational Geometry,"['Marijn J.H. Heule', 'Manfred Scheucher']","Satisfiability solving has been used to tackle a range of long-standing open math problems in recent years. We add another success by solving a geometry problem that originated a century ago. In the 1930s, Esther Klein's exploration of unavoidable shapes in planar point sets in general position showed that every set of five points includes four points in convex position. For a long time, it was open if an empty hexagon, i.e., six points in convex position without a point inside, can be avoided. In 2006, Gerken and Nicolás independently proved that the answer is no. We establish the exact bound: Every 30-point set in the plane in general position contains an empty hexagon. Our key contributions include an effective, compact encoding and a search-space partitioning strategy enabling linear-time speedups even when using thousands of cores."
7,Can Transformers Capture Spatial Relations between Objects?,Computer Vision and Pattern Recognition,"['Chuan Wen', 'Dinesh Jayaraman', 'Yang Gao']","Spatial relationships between objects represent key scene information for humans to understand and interact with the world. To study the capability of current computer vision systems to recognize physically grounded spatial relations, we start by proposing precise relation definitions that permit consistently annotating a benchmark dataset. Despite the apparent simplicity of this task relative to others in the recognition literature, we observe that existing approaches perform poorly on this benchmark. We propose new approaches exploiting the long-range attention capabilities of transformers for this task, and evaluating key design principles. We identify a simple ""RelatiViT"" architecture and demonstrate that it outperforms all current approaches. To our knowledge, this is the first method to convincingly outperform naive baselines on spatial relation prediction in in-the-wild settings. The code and datasets are available in \url{this https URL}."
8,Cost-Effective Activity Control of Asymptomatic Carriers in Layered Temporal Social Networks,Social and Information Networks,"['Masoumeh Moradian', 'Aresh Dadlani', 'Rasul Kairgeldin', 'Ahmad Khonsari']","The robustness of human social networks against epidemic propagation relies on the propensity for physical contact adaptation. During the early phase of infection, asymptomatic carriers exhibit the same activity level as susceptible individuals, which presents challenges for incorporating control measures in epidemic projection models. This paper focuses on modeling and cost-efficient activity control of susceptible and carrier individuals in the context of the susceptible-carrier-infected-removed (SCIR) epidemic model over a two-layer contact network. In this model, individuals switch from a static contact layer to create new links in a temporal layer based on state-dependent activation rates. We derive conditions for the infection to die out or persist in a homogeneous network. Considering the significant costs associated with reducing the activity of susceptible and carrier individuals, we formulate an optimization problem to minimize the disease decay rate while constrained by a limited budget. We propose the use of successive geometric programming (SGP) approximation for this optimization task. Through simulation experiments on Poisson random graphs, we assess the impact of different parameters on disease prevalence. The results demonstrate that our SGP framework achieves a cost reduction of nearly 33% compared to conventional methods based on degree and closeness centrality."
9,Few-Shot Relation Extraction with Hybrid Visual Evidence,Computation and Language,"['Jiaying Gong', 'Hoda Eldardiry']","The goal of few-shot relation extraction is to predict relations between name entities in a sentence when only a few labeled instances are available for training. Existing few-shot relation extraction methods focus on uni-modal information such as text only. This reduces performance when there are no clear contexts between the name entities described in text. We propose a multi-modal few-shot relation extraction model (MFS-HVE) that leverages both textual and visual semantic information to learn a multi-modal representation jointly. The MFS-HVE includes semantic feature extractors and multi-modal fusion components. The MFS-HVE semantic feature extractors are developed to extract both textual and visual features. The visual features include global image features and local object features within the image. The MFS-HVE multi-modal fusion unit integrates information from various modalities using image-guided attention, object-guided attention, and hybrid feature attention to fully capture the semantic interaction between visual regions of images and relevant texts. Extensive experiments conducted on two public datasets demonstrate that semantic visual information significantly improves the performance of few-shot relation prediction."
10,Subhomogeneous Deep Equilibrium Models,Machine Learning,"['Pietro Sittoni', 'Francesco Tudisco']","Implicit-depth neural networks have grown as powerful alternatives to traditional networks in various applications in recent years. However, these models often lack guarantees of existence and uniqueness, raising stability, performance, and reproducibility issues. In this paper, we present a new analysis of the existence and uniqueness of fixed points for implicit-depth neural networks based on the concept of subhomogeneous operators and the nonlinear Perron-Frobenius theory. Compared to previous similar analyses, our theory allows for weaker assumptions on the parameter matrices, thus yielding a more flexible framework for well-defined implicit networks. We illustrate the performance of the resulting subhomogeneous networks on feed-forward, convolutional, and graph neural network examples."
11,MAIDR: Making Statistical Visualizations Accessible with Multimodal Data Representation,Human-Computer Interaction,"['JooYoung Seo', 'Yilin Xia', 'Bongshin Lee', 'Sean McCurry', 'Yu Jun Yam']","This paper investigates new data exploration experiences that enable blind users to interact with statistical data visualizations$-$bar plots, heat maps, box plots, and scatter plots$-$leveraging multimodal data representations. In addition to sonification and textual descriptions that are commonly employed by existing accessible visualizations, our MAIDR (multimodal access and interactive data representation) system incorporates two additional modalities (braille and review) that offer complementary benefits. It also provides blind users with the autonomy and control to interactively access and understand data visualizations. In a user study involving 11 blind participants, we found the MAIDR system facilitated the accurate interpretation of statistical visualizations. Participants exhibited a range of strategies in combining multiple modalities, influenced by their past interactions and experiences with data visualizations. This work accentuates the overlooked potential of combining refreshable tactile representation with other modalities and elevates the discussion on the importance of user autonomy when designing accessible data visualizations."
12,Adaptive Learning Rate for Follow-the-Regularized-Leader: Competitive Ratio Analysis and Best-of-Both-Worlds,Machine Learning,"['Shinji Ito', 'Taira Tsuchiya', 'Junya Honda']","Follow-The-Regularized-Leader (FTRL) is known as an effective and versatile approach in online learning, where appropriate choice of the learning rate is crucial for smaller regret. To this end, we formulate the problem of adjusting FTRL's learning rate as a sequential decision-making problem and introduce the framework of competitive analysis. We establish a lower bound for the competitive ratio and propose update rules for learning rate that achieves an upper bound within a constant factor of this lower bound. Specifically, we illustrate that the optimal competitive ratio is characterized by the (approximate) monotonicity of components of the penalty term, showing that a constant competitive ratio is achievable if the components of the penalty term form a monotonically non-increasing sequence, and derive a tight competitive ratio when penalty terms are $\xi$-approximately monotone non-increasing. Our proposed update rule, referred to as \textit{stability-penalty matching}, also facilitates constructing the Best-Of-Both-Worlds (BOBW) algorithms for stochastic and adversarial environments. In these environments our result contributes to achieve tighter regret bound and broaden the applicability of algorithms for various settings such as multi-armed bandits, graph bandits, linear bandits, and contextual bandits."
13,Rethinking Inductive Biases for Surface Normal Estimation,Computer Vision and Pattern Recognition,"['Gwangbin Bae', 'Andrew J. Davison']","Despite the growing demand for accurate surface normal estimation models, existing methods use general-purpose dense prediction models, adopting the same inductive biases as other tasks. In this paper, we discuss the inductive biases needed for surface normal estimation and propose to (1) utilize the per-pixel ray direction and (2) encode the relationship between neighboring surface normals by learning their relative rotation. The proposed method can generate crisp - yet, piecewise smooth - predictions for challenging in-the-wild images of arbitrary resolution and aspect ratio. Compared to a recent ViT-based state-of-the-art model, our method shows a stronger generalization ability, despite being trained on an orders of magnitude smaller dataset. The code is available at this https URL."
14,Representing Guardedness in Call-by-Value and Guarded Parametrized Monads,Logic in Computer Science,['Sergey Goncharov'],"Like the notion of computation via (strong) monads serves to classify various flavours of impurity, including exceptions, non-determinism, probability, local and global store, the notion of guardedness classifies well-behavedness of cycles in various settings. In its most general form, the guardedness discipline applies to general symmetric monoidal categories and further specializes to Cartesian and co-Cartesian categories, where it governs guarded recursion and guarded iteration respectively. Here, even more specifically, we deal with the semantics of call-by-value guarded iteration. It was shown by Levy, Power and Thielecke that call-by-value languages can be generally interpreted in Freyd categories, but in order to represent effectful function spaces, such a category must canonically arise from a strong monad. We generalize this fact by showing that representing guarded effectful function spaces calls for certain parametrized monads (in the sense of Uustalu). This provides a description of guardedness as an intrinsic categorical property of programs, complementing the existing description of guardedness as a predicate on a category."
15,Self-Consistent Decoding for More Factual Open Responses,Computation and Language,"['Christopher Malon', 'Xiaodan Zhu']","Self-consistency has emerged as a powerful method for improving the accuracy of short answers generated by large language models. As previously defined, it only concerns the accuracy of a final answer parsed from generated text. In this work, we extend the idea to open response generation, by integrating voting into the decoding method. Each output sentence is selected from among multiple samples, conditioning on the previous selections, based on a simple token overlap score. We compare this ""Sample & Select"" method to greedy decoding, beam search, nucleus sampling, and the recently introduced hallucination avoiding decoders of DoLA, P-CRR, and S-CRR. We show that Sample & Select improves factuality by a 30% relative margin against these decoders in NLI-based evaluation on the subsets of CNN/DM and XSum used in the FRANK benchmark, while maintaining comparable ROUGE-1 F1 scores against reference summaries. We collect human verifications of the generated summaries, confirming the factual superiority of our method."
16,Tri-Modal Motion Retrieval by Learning a Joint Embedding Space,Computer Vision and Pattern Recognition,"['Kangning Yin', 'Shihao Zou', 'Yuxuan Ge', 'Zheng Tian']","Information retrieval is an ever-evolving and crucial research domain. The substantial demand for high-quality human motion data especially in online acquirement has led to a surge in human motion research works. Prior works have mainly concentrated on dual-modality learning, such as text and motion tasks, but three-modality learning has been rarely explored. Intuitively, an extra introduced modality can enrich a model's application scenario, and more importantly, an adequate choice of the extra modality can also act as an intermediary and enhance the alignment between the other two disparate modalities. In this work, we introduce LAVIMO (LAnguage-VIdeo-MOtion alignment), a novel framework for three-modality learning integrating human-centric videos as an additional modality, thereby effectively bridging the gap between text and motion. Moreover, our approach leverages a specially designed attention mechanism to foster enhanced alignment and synergistic effects among text, video, and motion modalities. Empirically, our results on the HumanML3D and KIT-ML datasets show that LAVIMO achieves state-of-the-art performance in various motion-related cross-modal retrieval tasks, including text-to-motion, motion-to-text, video-to-motion and motion-to-video."
17,Playing NetHack with LLMs: Potential & Limitations as Zero-Shot Agents,Artificial Intelligence,"['Dominik Jeurissen', 'Diego Perez-Liebana', 'Jeremy Gow', 'Duygu Cakmak', 'James Kwan']","Large Language Models (LLMs) have shown great success as high-level planners for zero-shot game-playing agents. However, these agents are primarily evaluated on Minecraft, where long-term planning is relatively straightforward. In contrast, agents tested in dynamic robot environments face limitations due to simplistic environments with only a few objects and interactions. To fill this gap in the literature, we present NetPlay, the first LLM-powered zero-shot agent for the challenging roguelike NetHack. NetHack is a particularly challenging environment due to its diverse set of items and monsters, complex interactions, and many ways to die.
NetPlay uses an architecture designed for dynamic robot environments, modified for NetHack. Like previous approaches, it prompts the LLM to choose from predefined skills and tracks past interactions to enhance decision-making. Given NetHack's unpredictable nature, NetPlay detects important game events to interrupt running skills, enabling it to react to unforeseen circumstances. While NetPlay demonstrates considerable flexibility and proficiency in interacting with NetHack's mechanics, it struggles with ambiguous task descriptions and a lack of explicit feedback. Our findings demonstrate that NetPlay performs best with detailed context information, indicating the necessity for dynamic methods in supplying context information for complex games such as NetHack."
18,Hydra: Computer Vision for Data Quality Monitoring,Computer Vision and Pattern Recognition,"['Thomas Britton', 'Torri Jeske', 'David Lawrence', 'Kishansingh Rajput']","Hydra is a system which utilizes computer vision to perform near real time data quality management, initially developed for Hall-D in 2019. Since then, it has been deployed across all experimental halls at Jefferson Lab, with the CLAS12 collaboration in Hall-B being the first outside of GlueX to fully utilize Hydra. The system comprises back end processes that manage the models, their inferences, and the data flow. The front-end components, accessible via web pages, allow detector experts and shift crews to view and interact with the system. This talk will give an overview of the Hydra system as well as highlight significant developments in Hydra's feature set, acute challenges with operating Hydra in all halls, and lessons learned along the way."
