Title,Subjects,Author(s),Abstract
Preventing Reward Hacking with Occupancy Measure Regularization,Machine Learning (cs.LG); Artificial Intelligence (cs.AI),"Cassidy Laidlaw, Shivam Singhal, Anca Dragan","Abstract:Reward hacking occurs when an agent performs very well with respect to a ""proxy"" reward function (which may be hand-specified or learned), but poorly with respect to the unknown true reward. Since ensuring good alignment between the proxy and true reward is extremely difficult, one approach to prevent reward hacking is optimizing the proxy conservatively. Prior work has particularly focused on enforcing the learned policy to behave similarly to a ""safe"" policy by penalizing the KL divergence between their action distributions (AD). However, AD regularization doesn't always work well since a small change in action distribution at a single state can lead to potentially calamitous outcomes, while large changes might not be indicative of any dangerous activity. Our insight is that when reward hacking, the agent visits drastically different states from those reached by the safe policy, causing large deviations in state occupancy measure (OM). Thus, we propose regularizing based on the OM divergence between policies instead of AD divergence to prevent reward hacking. We theoretically establish that OM regularization can more effectively avoid large drops in true reward. Then, we empirically demonstrate in a variety of realistic environments that OM divergence is superior to AD divergence for preventing reward hacking by regularizing towards a safe policy. Furthermore, we show that occupancy measure divergence can also regularize learned policies away from reward hacking behavior. Our code and data are available at this https URL"
How Well Can Transformers Emulate In-context Newton's Method?,Machine Learning (cs.LG); Artificial Intelligence (cs.AI); Optimization and Control (math.OC); Machine Learning (stat.ML),"Angeliki Giannou, Liu Yang, Tianhao Wang, Dimitris Papailiopoulos, Jason D. Lee","Abstract:Transformer-based models have demonstrated remarkable in-context learning capabilities, prompting extensive research into its underlying mechanisms. Recent studies have suggested that Transformers can implement first-order optimization algorithms for in-context learning and even second order ones for the case of linear regression. In this work, we study whether Transformers can perform higher order optimization methods, beyond the case of linear regression. We establish that linear attention Transformers with ReLU layers can approximate second order optimization algorithms for the task of logistic regression and achieve $\epsilon$ error with only a logarithmic to the error more layers. As a by-product we demonstrate the ability of even linear attention-only Transformers in implementing a single step of Newton's iteration for matrix inversion with merely two layers. These results suggest the ability of the Transformer architecture to implement complex algorithms, beyond gradient descent."
On the computation of stable coupled state-space models for dynamic  substructuring applications,Systems and Control (eess.SY); Dynamical Systems (math.DS),"R.S.O. Dias, M. Martarelli, P. Chiariotti","Abstract:This paper aims at introducing a methodology to compute stable coupled state-space models for dynamic substructuring applications by introducing two novel approaches targeted to accomplish this task: a) a procedure to impose Newtons's second law without relying on the use of undamped RCMs (residual compensation modes) and b) a novel approach to impose stability on unstable coupled state-space models. The enforcement of stability is performed by dividing the unstable model into two different models, one composed by the stable poles (stable model) and the other composed by the unstable ones (unstable model). Then, the poles of the unstable state-space model are forced to be stable, leading to the computation of a stabilized state-space model. Afterwards, to make sure that the Frequency Response Functions (FRFs) of the stabilized model well match the FRFs of the unstable model, the Least-Squares Frequency Domain (LSFD) method is exploited to update the modal parameters of the stabilized model composed by the pairs of complex conjugate poles. The validity of the proposed methodologies is presented and discussed by exploiting experimental data. Indeed, by exploiting the FRFs of a real system, accurate state-space models respecting Newton's second law are computed. Then, decoupling and coupling operations are performed with the identified state-space models, no matter the models resultant from the decoupling/coupling operations are unstable. Stability is then imposed on the computed unstable coupled model by following the approach proposed in this paper. The methodology proved to work well on these data. Moreover, the paper also shows that the coupled state-space models obtained using this methodology are suitable to be exploited in time-domain analyses and simulations."
Behavior Generation with Latent Actions,Machine Learning (cs.LG); Artificial Intelligence (cs.AI); Robotics (cs.RO),"Seungjae Lee, Yibin Wang, Haritheja Etukuru, H. Jin Kim, Nur Muhammad Mahi Shafiullah, Lerrel Pinto","Abstract:Generative modeling of complex behaviors from labeled datasets has been a longstanding problem in decision making. Unlike language or image generation, decision making requires modeling actions - continuous-valued vectors that are multimodal in their distribution, potentially drawn from uncurated sources, where generation errors can compound in sequential prediction. A recent class of models called Behavior Transformers (BeT) addresses this by discretizing actions using k-means clustering to capture different modes. However, k-means struggles to scale for high-dimensional action spaces or long sequences, and lacks gradient information, and thus BeT suffers in modeling long-range actions. In this work, we present Vector-Quantized Behavior Transformer (VQ-BeT), a versatile model for behavior generation that handles multimodal action prediction, conditional generation, and partial observations. VQ-BeT augments BeT by tokenizing continuous actions with a hierarchical vector quantization module. Across seven environments including simulated manipulation, autonomous driving, and robotics, VQ-BeT improves on state-of-the-art models such as BeT and Diffusion Policies. Importantly, we demonstrate VQ-BeT's improved ability to capture behavior modes while accelerating inference speed 5x over Diffusion Policies. Videos and code can be found this https URL"
Unifying and Certifying Top-Quality Planning,Artificial Intelligence (cs.AI),"Michael Katz, Junkyu Lee, Shirin Sohrabi","Abstract:The growing utilization of planning tools in practical scenarios has sparked an interest in generating multiple high-quality plans. Consequently, a range of computational problems under the general umbrella of top-quality planning were introduced over a short time period, each with its own definition. In this work, we show that the existing definitions can be unified into one, based on a dominance relation. The different computational problems, therefore, simply correspond to different dominance relations. Given the unified definition, we can now certify the top-quality of the solutions, leveraging existing certification of unsolvability and optimality. We show that task transformations found in the existing literature can be employed for the efficient certification of various top-quality planning problems and propose a novel transformation to efficiently certify loopless top-quality planning."
MOKA: Open-Vocabulary Robotic Manipulation through Mark-Based Visual  Prompting,Robotics (cs.RO); Artificial Intelligence (cs.AI),"Fangchen Liu, Kuan Fang, Pieter Abbeel, Sergey Levine","Abstract:Open-vocabulary generalization requires robotic systems to perform tasks involving complex and diverse environments and task goals. While the recent advances in vision language models (VLMs) present unprecedented opportunities to solve unseen problems, how to utilize their emergent capabilities to control robots in the physical world remains an open question. In this paper, we present MOKA (Marking Open-vocabulary Keypoint Affordances), an approach that employs VLMs to solve robotic manipulation tasks specified by free-form language descriptions. At the heart of our approach is a compact point-based representation of affordance and motion that bridges the VLM's predictions on RGB images and the robot's motions in the physical world. By prompting a VLM pre-trained on Internet-scale data, our approach predicts the affordances and generates the corresponding motions by leveraging the concept understanding and commonsense knowledge from broad sources. To scaffold the VLM's reasoning in zero-shot, we propose a visual prompting technique that annotates marks on the images, converting the prediction of keypoints and waypoints into a series of visual question answering problems that are feasible for the VLM to solve. Using the robot experiences collected in this way, we further investigate ways to bootstrap the performance through in-context learning and policy distillation. We evaluate and analyze MOKA's performance on a variety of manipulation tasks specified by free-form language descriptions, such as tool use, deformable body manipulation, and object rearrangement."
Solving the bongard-logo problem by modeling a probabilistic model,Computer Vision and Pattern Recognition (cs.CV),"Ruizhuo Song, Beiming Yuan","Abstract:Abstract reasoning problems challenge the perceptual and cognitive abilities of AI algorithms, demanding deeper pattern discernment and inductive reasoning beyond explicit image features. This study introduces PMoC, a tailored probability model for the Bongard-Logo problem, achieving high reasoning accuracy by constructing independent probability models. Additionally, we present Pose-Transformer, an enhanced Transformer-Encoder designed for complex abstract reasoning tasks, including Bongard-Logo, RAVEN, I-RAVEN, and PGM. Pose-Transformer incorporates positional information learning, inspired by capsule networks' pose matrices, enhancing its focus on local positional relationships in image data processing. When integrated with PMoC, it further improves reasoning accuracy. Our approach effectively addresses reasoning difficulties associated with abstract entities' positional changes, outperforming previous models on the OIG, D3$\times$3 subsets of RAVEN, and PGM databases. This research contributes to advancing AI's capabilities in abstract reasoning and cognitive pattern recognition."
Reaching Consensus in Cooperative Multi-Agent Reinforcement Learning  with Goal Imagination,Artificial Intelligence (cs.AI); Machine Learning (cs.LG),"Liangzhou Wang, Kaiwen Zhu, Fengming Zhu, Xinghu Yao, Shujie Zhang, Deheng Ye, Haobo Fu, Qiang Fu, Wei Yang","Abstract:Reaching consensus is key to multi-agent coordination. To accomplish a cooperative task, agents need to coherently select optimal joint actions to maximize the team reward. However, current cooperative multi-agent reinforcement learning (MARL) methods usually do not explicitly take consensus into consideration, which may cause miscoordination problem. In this paper, we propose a model-based consensus mechanism to explicitly coordinate multiple agents. The proposed Multi-agent Goal Imagination (MAGI) framework guides agents to reach consensus with an Imagined common goal. The common goal is an achievable state with high value, which is obtained by sampling from the distribution of future states. We directly model this distribution with a self-supervised generative model, thus alleviating the ""curse of dimensinality"" problem induced by multi-agent multi-step policy rollout commonly used in model-based methods. We show that such efficient consensus mechanism can guide all agents cooperatively reaching valuable future states. Results on Multi-agent Particle-Environments and Google Research Football environment demonstrate the superiority of MAGI in both sample efficiency and performance."
SNIFFER: Multimodal Large Language Model for Explainable Out-of-Context  Misinformation Detection,Multimedia (cs.MM); Artificial Intelligence (cs.AI); Computation and Language (cs.CL); Computers and Society (cs.CY),"Peng Qi, Zehong Yan, Wynne Hsu, Mong Li Lee","Abstract:Misinformation is a prevalent societal issue due to its potential high risks. Out-of-context (OOC) misinformation, where authentic images are repurposed with false text, is one of the easiest and most effective ways to mislead audiences. Current methods focus on assessing image-text consistency but lack convincing explanations for their judgments, which is essential for debunking misinformation. While Multimodal Large Language Models (MLLMs) have rich knowledge and innate capability for visual reasoning and explanation generation, they still lack sophistication in understanding and discovering the subtle crossmodal differences. In this paper, we introduce SNIFFER, a novel multimodal large language model specifically engineered for OOC misinformation detection and explanation. SNIFFER employs two-stage instruction tuning on InstructBLIP. The first stage refines the model's concept alignment of generic objects with news-domain entities and the second stage leverages language-only GPT-4 generated OOC-specific instruction data to fine-tune the model's discriminatory powers. Enhanced by external tools and retrieval, SNIFFER not only detects inconsistencies between text and image but also utilizes external knowledge for contextual verification. Our experiments show that SNIFFER surpasses the original MLLM by over 40% and outperforms state-of-the-art methods in detection accuracy. SNIFFER also provides accurate and persuasive explanations as validated by quantitative and human evaluations."
Learning Explicitly Conditioned Sparsifying Transforms,Numerical Analysis (math.NA); Artificial Intelligence (cs.AI); Machine Learning (cs.LG); Optimization and Control (math.OC),"Andrei Pătraşcu, Cristian Rusu, Paul Irofti","Abstract:Sparsifying transforms became in the last decades widely known tools for finding structured sparse representations of signals in certain transform domains. Despite the popularity of classical transforms such as DCT and Wavelet, learning optimal transforms that guarantee good representations of data into the sparse domain has been recently analyzed in a series of papers. Typically, the conditioning number and representation ability are complementary key features of learning square transforms that may not be explicitly controlled in a given optimization model. Unlike the existing approaches from the literature, in our paper, we consider a new sparsifying transform model that enforces explicit control over the data representation quality and the condition number of the learned transforms. We confirm through numerical experiments that our model presents better numerical behavior than the state-of-the-art."
PARADISE: Evaluating Implicit Planning Skills of Language Models with  Procedural Warnings and Tips Dataset,Computation and Language (cs.CL),"Arda Uzunoğlu, Abdalfatah Rashid Safa, Gözde Gül Şahin","Abstract:Recently, there has been growing interest within the community regarding whether large language models are capable of planning or executing plans. However, most prior studies use LLMs to generate high-level plans for simplified scenarios lacking linguistic complexity and domain diversity, limiting analysis of their planning abilities. These setups constrain evaluation methods (e.g., predefined action space), architectural choices (e.g., only generative models), and overlook the linguistic nuances essential for realistic analysis. To tackle this, we present PARADISE, an abductive reasoning task using Q\&A format on practical procedural text sourced from wikiHow. It involves warning and tip inference tasks directly associated with goals, excluding intermediary steps, with the aim of testing the ability of the models to infer implicit knowledge of the plan solely from the given goal. Our experiments, utilizing fine-tuned language models and zero-shot prompting, reveal the effectiveness of task-specific small models over large language models in most scenarios. Despite advancements, all models fall short of human performance. Notably, our analysis uncovers intriguing insights, such as variations in model behavior with dropped keywords, struggles of BERT-family and GPT-4 with physical and abstract goals, and the proposed tasks offering valuable prior knowledge for other unseen procedural tasks. The PARADISE dataset and associated resources are publicly available for further research exploration with this https URL."
Leveraging Federated Learning and Edge Computing for Recommendation  Systems within Cloud Computing Networks,Artificial Intelligence (cs.AI),"Yaqian Qi, Yaqian Qi, Xiangxiang Wang, Hanzhe Li, Jingxiao Tian","Abstract:To enable large-scale and efficient deployment of artificial intelligence (AI), the combination of AI and edge computing has spawned Edge Intelligence, which leverages the computing and communication capabilities of end devices and edge servers to process data closer to where it is generated. A key technology for edge intelligence is the privacy-protecting machine learning paradigm known as Federated Learning (FL), which enables data owners to train models without having to transfer raw data to third-party servers. However, FL networks are expected to involve thousands of heterogeneous distributed devices. As a result, communication efficiency remains a key bottleneck. To reduce node failures and device exits, a Hierarchical Federated Learning (HFL) framework is proposed, where a designated cluster leader supports the data owner through intermediate model aggregation. Therefore, based on the improvement of edge server resource utilization, this paper can effectively make up for the limitation of cache capacity. In order to mitigate the impact of soft clicks on the quality of user experience (QoE), the authors model the user QoE as a comprehensive system cost. To solve the formulaic problem, the authors propose a decentralized caching algorithm with federated deep reinforcement learning (DRL) and federated learning (FL), where multiple agents learn and make decisions independently"
Design2Code: How Far Are We From Automating Front-End Engineering?,Computation and Language (cs.CL); Computer Vision and Pattern Recognition (cs.CV); Computers and Society (cs.CY),"Chenglei Si, Yanzhe Zhang, Zhengyuan Yang, Ruibo Liu, Diyi Yang","Abstract:Generative AI has made rapid advancements in recent years, achieving unprecedented capabilities in multimodal understanding and code generation. This can enable a new paradigm of front-end development, in which multimodal LLMs might directly convert visual designs into code implementations. In this work, we formalize this as a Design2Code task and conduct comprehensive benchmarking. Specifically, we manually curate a benchmark of 484 diverse real-world webpages as test cases and develop a set of automatic evaluation metrics to assess how well current multimodal LLMs can generate the code implementations that directly render into the given reference webpages, given the screenshots as input. We also complement automatic metrics with comprehensive human evaluations. We develop a suite of multimodal prompting methods and show their effectiveness on GPT-4V and Gemini Pro Vision. We further finetune an open-source Design2Code-18B model that successfully matches the performance of Gemini Pro Vision. Both human evaluation and automatic metrics show that GPT-4V performs the best on this task compared to other models. Moreover, annotators think GPT-4V generated webpages can replace the original reference webpages in 49% of cases in terms of visual appearance and content; and perhaps surprisingly, in 64% of cases GPT-4V generated webpages are considered better than the original reference webpages. Our fine-grained break-down metrics indicate that open-source models mostly lag in recalling visual elements from the input webpages and in generating correct layout designs, while aspects like text content and coloring can be drastically improved with proper finetuning."
PalmProbNet: A Probabilistic Approach to Understanding Palm  Distributions in Ecuadorian Tropical Forest via Transfer Learning,Computer Vision and Pattern Recognition (cs.CV); Machine Learning (cs.LG),"Kangning Cui, Zishan Shao, Gregory Larsen, Victor Pauca, Sarra Alqahtani, David Segurado, João Pinheiro, Manqi Wang, David Lutz, Robert Plemmons, Miles Silman","Abstract:Palms play an outsized role in tropical forests and are important resources for humans and wildlife. A central question in tropical ecosystems is understanding palm distribution and abundance. However, accurately identifying and localizing palms in geospatial imagery presents significant challenges due to dense vegetation, overlapping canopies, and variable lighting conditions in mixed-forest landscapes. Addressing this, we introduce PalmProbNet, a probabilistic approach utilizing transfer learning to analyze high-resolution UAV-derived orthomosaic imagery, enabling the detection of palm trees within the dense canopy of the Ecuadorian Rainforest. This approach represents a substantial advancement in automated palm detection, effectively pinpointing palm presence and locality in mixed tropical rainforests. Our process begins by generating an orthomosaic image from UAV images, from which we extract and label palm and non-palm image patches in two distinct sizes. These patches are then used to train models with an identical architecture, consisting of an unaltered pre-trained ResNet-18 and a Multilayer Perceptron (MLP) with specifically trained parameters. Subsequently, PalmProbNet employs a sliding window technique on the landscape orthomosaic, using both small and large window sizes to generate a probability heatmap. This heatmap effectively visualizes the distribution of palms, showcasing the scalability and adaptability of our approach in various forest densities. Despite the challenging terrain, our method demonstrated remarkable performance, achieving an accuracy of 97.32% and a Cohen's kappa of 94.59% in testing."
Rethinking Clustered Federated Learning in NOMA Enhanced Wireless  Networks,Networking and Internet Architecture (cs.NI); Information Theory (cs.IT); Machine Learning (cs.LG),"Yushen Lin, Kaidi Wang, Zhiguo Ding","Abstract:This study explores the benefits of integrating the novel clustered federated learning (CFL) approach with non-orthogonal multiple access (NOMA) under non-independent and identically distributed (non-IID) datasets, where multiple devices participate in the aggregation with time limitations and a finite number of sub-channels. A detailed theoretical analysis of the generalization gap that measures the degree of non-IID in the data distribution is presented. Following that, solutions to address the challenges posed by non-IID conditions are proposed with the analysis of the properties. Specifically, users' data distributions are parameterized as concentration parameters and grouped using spectral clustering, with Dirichlet distribution serving as the prior. The investigation into the generalization gap and convergence rate guides the design of sub-channel assignments through the matching-based algorithm, and the power allocation is achieved by Karush-Kuhn-Tucker (KKT) conditions with the derived closed-form solution. The extensive simulation results show that the proposed cluster-based FL framework can outperform FL baselines in terms of both test accuracy and convergence rate. Moreover, jointly optimizing sub-channel and power allocation in NOMA-enhanced networks can lead to a significant improvement."
Deep-Learned Compression for Radio-Frequency Signal Classification,Machine Learning (cs.LG); Networking and Internet Architecture (cs.NI); Signal Processing (eess.SP),"Armani Rodriguez, Yagna Kaasaragadda, Silvija Kokalj-Filipovic","Abstract:Next-generation cellular concepts rely on the processing of large quantities of radio-frequency (RF) samples. This includes Radio Access Networks (RAN) connecting the cellular front-end based on software defined radios (SDRs) and a framework for the AI processing of spectrum-related data. The RF data collected by the dense RAN radio units and spectrum sensors may need to be jointly processed for intelligent decision making. Moving large amounts of data to AI agents may result in significant bandwidth and latency costs. We propose a deep learned compression (DLC) model, HQARF, based on learned vector quantization (VQ), to compress the complex-valued samples of RF signals comprised of 6 modulation classes. We are assessing the effects of HQARF on the performance of an AI model trained to infer the modulation class of the RF signal. Compression of narrow-band RF samples for the training and off-the-site inference will allow for an efficient use of the bandwidth and storage for non-real-time analytics, and for a decreased delay in real-time applications. While exploring the effectiveness of the HQARF signal reconstructions in modulation classification tasks, we highlight the DLC optimization space and some open problems related to the training of the VQ embedded in HQARF."
