Title,Subjects,Author(s),Abstract
Robust Federated Learning Mitigates Client-side Training Data  Distribution Inference Attacks,"Cryptography and Security (cs.CR); Distributed, Parallel, and Cluster Computing (cs.DC); Machine Learning (cs.LG)","Yichang Xu, Ming Yin, Minghong Fang, Neil Zhenqiang Gong","Abstract:Recent studies have revealed that federated learning (FL), once considered secure due to clients not sharing their private data with the server, is vulnerable to attacks such as client-side training data distribution inference, where a malicious client can recreate the victim's data. While various countermeasures exist, they are not practical, often assuming server access to some training data or knowledge of label distribution before the attack.
In this work, we bridge the gap by proposing InferGuard, a novel Byzantine-robust aggregation rule aimed at defending against client-side training data distribution inference attacks. In our proposed InferGuard, the server first calculates the coordinate-wise median of all the model updates it receives. A client's model update is considered malicious if it significantly deviates from the computed median update. We conduct a thorough evaluation of our proposed InferGuard on five benchmark datasets and perform a comparison with ten baseline methods. The results of our experiments indicate that our defense mechanism is highly effective in protecting against client-side training data distribution inference attacks, even against strong adaptive attacks. Furthermore, our method substantially outperforms the baseline methods in various practical FL scenarios."
Dual Mean-Teacher: An Unbiased Semi-Supervised Framework for  Audio-Visual Source Localization,Computer Vision and Pattern Recognition (cs.CV); Machine Learning (cs.LG); Multimedia (cs.MM); Sound (cs.SD); Audio and Speech Processing (eess.AS),"Yuxin Guo, Shijie Ma, Hu Su, Zhiqing Wang, Yuhao Zhao, Wei Zou, Siyang Sun, Yun Zheng","Abstract:Audio-Visual Source Localization (AVSL) aims to locate sounding objects within video frames given the paired audio clips. Existing methods predominantly rely on self-supervised contrastive learning of audio-visual correspondence. Without any bounding-box annotations, they struggle to achieve precise localization, especially for small objects, and suffer from blurry boundaries and false positives. Moreover, the naive semi-supervised method is poor in fully leveraging the information of abundant unlabeled data. In this paper, we propose a novel semi-supervised learning framework for AVSL, namely Dual Mean-Teacher (DMT), comprising two teacher-student structures to circumvent the confirmation bias issue. Specifically, two teachers, pre-trained on limited labeled data, are employed to filter out noisy samples via the consensus between their predictions, and then generate high-quality pseudo-labels by intersecting their confidence maps. The sufficient utilization of both labeled and unlabeled data and the proposed unbiased framework enable DMT to outperform current state-of-the-art methods by a large margin, with CIoU of 90.4% and 48.8% on Flickr-SoundNet and VGG-Sound Source, obtaining 8.9%, 9.6% and 4.6%, 6.4% improvements over self- and semi-supervised methods respectively, given only 3% positional-annotations. We also extend our framework to some existing AVSL methods and consistently boost their performance."
Language Guided Exploration for RL Agents in Text Environments,Computation and Language (cs.CL),"Hitesh Golchha, Sahil Yerawar, Dhruvesh Patel, Soham Dan, Keerthiram Murugesan","Abstract:Real-world sequential decision making is characterized by sparse rewards and large decision spaces, posing significant difficulty for experiential learning systems like $\textit{tabula rasa}$ reinforcement learning (RL) agents. Large Language Models (LLMs), with a wealth of world knowledge, can help RL agents learn quickly and adapt to distribution shifts. In this work, we introduce Language Guided Exploration (LGE) framework, which uses a pre-trained language model (called GUIDE ) to provide decision-level guidance to an RL agent (called EXPLORER). We observe that on ScienceWorld (Wang et al.,2022), a challenging text environment, LGE outperforms vanilla RL agents significantly and also outperforms other sophisticated methods like Behaviour Cloning and Text Decision Transformer."
Simplicity in Complexity,Computer Vision and Pattern Recognition (cs.CV); Artificial Intelligence (cs.AI); Neurons and Cognition (q-bio.NC),"Kevin Shen, Surabhi S Nath, Aenne Brielmann, Peter Dayan","Abstract:The complexity of visual stimuli plays an important role in many cognitive phenomena, including attention, engagement, memorability, time perception and aesthetic evaluation. Despite its importance, complexity is poorly understood and ironically, previous models of image complexity have been quite \textit{complex}. There have been many attempts to find handcrafted features that explain complexity, but these features are usually dataset specific, and hence fail to generalise. On the other hand, more recent work has employed deep neural networks to predict complexity, but these models remain difficult to interpret, and do not guide a theoretical understanding of the problem. Here we propose to model complexity using segment-based representations of images. We use state-of-the-art segmentation models, SAM and FC-CLIP, to quantify the number of segments at multiple granularities, and the number of classes in an image respectively. We find that complexity is well-explained by a simple linear model with these two features across six diverse image-sets of naturalistic scene and art images. This suggests that the complexity of images can be surprisingly simple."
CoGenesis: A Framework Collaborating Large and Small Language Models for  Secure Context-Aware Instruction Following,Computation and Language (cs.CL),"Kaiyan Zhang, Jianyu Wang, Ermo Hua, Biqing Qi, Ning Ding, Bowen Zhou","Abstract:With the advancement of language models (LMs), their exposure to private data is increasingly inevitable, and their deployment (especially for smaller ones) on personal devices, such as PCs and smartphones, has become a prevailing trend. In contexts laden with user information, enabling models to both safeguard user privacy and execute commands efficiently emerges as an essential research imperative. In this paper, we propose CoGenesis, a collaborative generation framework integrating large (hosted on cloud infrastructure) and small models (deployed on local devices) to address privacy concerns logically. Initially, we design a pipeline to create personalized writing instruction datasets enriched with extensive context details as the testbed of this research issue. Subsequently, we introduce two variants of CoGenesis based on sketch and logits respectively. Our experimental findings, based on our synthesized dataset and two additional open-source datasets, indicate that: 1) Large-scale models perform well when provided with user context but struggle in the absence of such context. 2) While specialized smaller models fine-tuned on the synthetic dataset show promise, they still lag behind their larger counterparts. 3) Our CoGenesis framework, utilizing mixed-scale models, showcases competitive performance, providing a feasible solution to privacy issues."
A Federated Deep Learning Approach for Privacy-Preserving Real-Time  Transient Stability Predictions in Power Systems,Systems and Control (eess.SY),"Maeshal Hijazi, Payman Dehghanian","Abstract:Maintaining the privacy of power system data is essential for protecting sensitive information and ensuring the operation security of critical infrastructure. Therefore, the adoption of centralized deep learning (DL) transient stability assessment (TSA) frameworks can introduce risks to electric utilities. This is because these frameworks make utility data susceptible to cyber threats and communication issues when transmitting data to a central server for training a single TSA model. Additionally, the centralized approach demands significant computational resources, which may not always be readily available. In light of these challenges, this paper introduces a federated DL-based TSA framework designed to identify the operating states of the power system. Instead of local utilities transmitting their data to a central server for centralized model training, they independently train their own TSA models using their respective datasets. Subsequently, the parameters of each local TSA model are sent to a central server for model aggregation, and the resulting model is shared back with the local clients. This approach not only preserves the integrity of local utility data, making it resilient against cyber threats but also reduces the computational demands for local TSA model training. The proposed approach is tested on four local clients each having the IEEE 39-bus test system."
NRDF: Neural Riemannian Distance Fields for Learning Articulated Pose  Priors,Computer Vision and Pattern Recognition (cs.CV),"Yannan He, Garvita Tiwari, Tolga Birdal, Jan Eric Lenssen, Gerard Pons-Moll","Abstract:Faithfully modeling the space of articulations is a crucial task that allows recovery and generation of realistic poses, and remains a notorious challenge. To this end, we introduce Neural Riemannian Distance Fields (NRDFs), data-driven priors modeling the space of plausible articulations, represented as the zero-level-set of a neural field in a high-dimensional product-quaternion space. To train NRDFs only on positive examples, we introduce a new sampling algorithm, ensuring that the geodesic distances follow a desired distribution, yielding a principled distance field learning paradigm. We then devise a projection algorithm to map any random pose onto the level-set by an adaptive-step Riemannian optimizer, adhering to the product manifold of joint rotations at all times. NRDFs can compute the Riemannian gradient via backpropagation and by mathematical analogy, are related to Riemannian flow matching, a recent generative model. We conduct a comprehensive evaluation of NRDF against other pose priors in various downstream tasks, i.e., pose generation, image-based pose estimation, and solving inverse kinematics, highlighting NRDF's superior performance. Besides humans, NRDF's versatility extends to hand and animal poses, as it can effectively represent any articulation."
"Angry Men, Sad Women: Large Language Models Reflect Gendered Stereotypes  in Emotion Attribution",Computation and Language (cs.CL),"Flor Miriam Plaza-del-Arco, Amanda Cercas Curry, Alba Curry, Gavin Abercrombie, Dirk Hovy","Abstract:Large language models (LLMs) reflect societal norms and biases, especially about gender. While societal biases and stereotypes have been extensively researched in various NLP applications, there is a surprising gap for emotion analysis. However, emotion and gender are closely linked in societal discourse. E.g., women are often thought of as more empathetic, while men's anger is more socially accepted. To fill this gap, we present the first comprehensive study of gendered emotion attribution in five state-of-the-art LLMs (open- and closed-source). We investigate whether emotions are gendered, and whether these variations are based on societal stereotypes. We prompt the models to adopt a gendered persona and attribute emotions to an event like 'When I had a serious argument with a dear person'. We then analyze the emotions generated by the models in relation to the gender-event pairs. We find that all models consistently exhibit gendered emotions, influenced by gender stereotypes. These findings are in line with established research in psychology and gender studies. Our study sheds light on the complex societal interplay between language, gender, and emotion. The reproduction of emotion stereotypes in LLMs allows us to use those models to study the topic in detail, but raises questions about the predictive use of those same LLMs for emotion applications."
Motion-Corrected Moving Average: Including Post-Hoc Temporal Information  for Improved Video Segmentation,Computer Vision and Pattern Recognition (cs.CV),"Robert Mendel (1), Tobias Rueckert (1), Dirk Wilhelm (2), Daniel Rueckert (3, 4), Christoph Palm (1, 5) ((1) Regensburg Medical Image Computing (ReMIC), Ostbayerische Technische Hochschule Regensburg (OTH Regensburg), Regensburg, Germany, (2) Department of Surgery, Faculty of Medicine, Klinikum rechts der Isar, Technical University of Munich, Munich, Germany, (3) Artificial Intelligence in Healthcare and Medicine, Klinikum rechts der Isar, Technical University of Munich, Munich, Germany, (4) Department of Computing, Imperial College London, London, UK, (5) Regensburg Center of Health Sciences and Technology (RCHST), OTH Regensburg, Regensburg, Germany)","Abstract:Real-time computational speed and a high degree of precision are requirements for computer-assisted interventions. Applying a segmentation network to a medical video processing task can introduce significant inter-frame prediction noise. Existing approaches can reduce inconsistencies by including temporal information but often impose requirements on the architecture or dataset. This paper proposes a method to include temporal information in any segmentation model and, thus, a technique to improve video segmentation performance without alterations during training or additional labeling. With Motion-Corrected Moving Average, we refine the exponential moving average between the current and previous predictions. Using optical flow to estimate the movement between consecutive frames, we can shift the prior term in the moving-average calculation to align with the geometry of the current frame. The optical flow calculation does not require the output of the model and can therefore be performed in parallel, leading to no significant runtime penalty for our approach. We evaluate our approach on two publicly available segmentation datasets and two proprietary endoscopic datasets and show improvements over a baseline approach."
Necessary and Sufficient Conditions to the Problem of Input-Output  Extension of Internally Controlled Underactuated Nonlinear Systems,Systems and Control (eess.SY),"Mirko Mizzoni, Amr Afifi, Antonio Franchi","Abstract:In this letter, we address the problem of re-targeting a commercial under-actuated robotic system to a higher dimensional output task. Commercial platforms are equipped with an on-board low-level internal controller that provides the user some virtual references inputs and cannot be replaced. Such controller may control in practice only a subset of the total degrees-of-freedom of the system. Our primary objective is to augment these systems by introducing supplementary inputs, attaining increased output capability. Integrating such additional inputs into the control framework introduces a layer of complexity, raising questions about the compatibility and cohesiveness of the overall system. We derive necessary and sufficient conditions under which it is possible to extend the controlled outputs by adding extra inputs when one is forced to keep the internal controller unmodified. We underscore the efficacy and universality of our proposed methodology through the presentation of two relevant examples."
Equilibria in Two-Stage Facility Location with Atomic Clients,Computer Science and Game Theory (cs.GT); Artificial Intelligence (cs.AI),"Simon Krogmann, Pascal Lenzner, Alexander Skopalik, Marc Uetz, Marnix C. Vos","Abstract:We consider competitive facility location as a two-stage multi-agent system with two types of clients. For a given host graph with weighted clients on the vertices, first facility agents strategically select vertices for opening their facilities. Then, the clients strategically select which of the opened facilities in their neighborhood to patronize. Facilities want to attract as much client weight as possible, clients want to minimize congestion on the chosen facility.
All recently studied versions of this model assume that clients can split their weight strategically. We consider clients with unsplittable weights, but allow mixed strategies. So clients may randomize over which facility to patronize. Besides modeling a natural client behavior, this subtle change yields drastic changes, e.g., for a given facility placement, qualitatively different client equilibria are possible.
As our main result, we show that pure subgame perfect equilibria always exist if all client weights are identical. For this, we use a novel potential function argument, employing a hierarchical classification of the clients and sophisticated rounding in each step. In contrast, for non-identical clients, we show that deciding the existence of even approximately stable states is computationally intractable. On the positive side, we give a tight bound of 2 on the price of anarchy which implies high social welfare of equilibria, if they exist."
Improved LiDAR Odometry and Mapping using Deep Semantic Segmentation and  Novel Outliers Detection,Computer Vision and Pattern Recognition (cs.CV); Artificial Intelligence (cs.AI); Robotics (cs.RO),"Mohamed Afifi, Mohamed ElHelw","Abstract:Perception is a key element for enabling intelligent autonomous navigation. Understanding the semantics of the surrounding environment and accurate vehicle pose estimation are essential capabilities for autonomous vehicles, including self-driving cars and mobile robots that perform complex tasks. Fast moving platforms like self-driving cars impose a hard challenge for localization and mapping algorithms. In this work, we propose a novel framework for real-time LiDAR odometry and mapping based on LOAM architecture for fast moving platforms. Our framework utilizes semantic information produced by a deep learning model to improve point-to-line and point-to-plane matching between LiDAR scans and build a semantic map of the environment, leading to more accurate motion estimation using LiDAR data. We observe that including semantic information in the matching process introduces a new type of outlier matches to the process, where matching occur between different objects of the same semantic class. To this end, we propose a novel algorithm that explicitly identifies and discards potential outliers in the matching process. In our experiments, we study the effect of improving the matching process on the robustness of LiDAR odometry against high speed motion. Our experimental evaluations on KITTI dataset demonstrate that utilizing semantic information and rejecting outliers significantly enhance the robustness of LiDAR odometry and mapping when there are large gaps between scan acquisition poses, which is typical for fast moving platforms."
On-demand Mobility Services for Urban Resilience: A Review Towards  Human-Machine Collaborative Future,Computers and Society (cs.CY),Jiangbo Yu,"Abstract:Mobility-on-demand (MOD) services have the potential to significantly improve the adaptiveness and recovery of urban logistics and transportation infrastructure, in the wake of disruptive events. This paper presents a survey on the usage of MOD services for resilience improvement (MOD-R) and finds a noticeable increase within recent years on this topic across four main areas: resilient MOD services, novel usage of MOD-R services for improving supply chain resilience, empirical impact evaluation, and supporting technologies. MOD-R services have been utilized for anomaly detection, essential supply delivery, evacuation and rescue, on-site medical care, power grid stabilization, transit service substitution during downtime, and infrastructure and equipment repair. The review reveals integrating electrification, automation, and advanced communication technologies offers significant synergistic benefits. The review also suggests the importance of harnessing the collective capabilities of humans and intelligent machines to effectively implement versatile, multi-functional MOD-R services during crises."
Biomechanical Comparison of Human Walking Locomotion on Solid Ground and  Sand,Robotics (cs.RO),"Chunchu Zhu, Xunjie Chen, Jingang Yi","Abstract:Current studies on human locomotion focus mainly on solid ground walking conditions. In this paper, we present a biomechanic comparison of human walking locomotion on solid ground and sand. A novel dataset containing 3-dimensional motion and biomechanical data from 20 able-bodied adults for locomotion on solid ground and sand is collected. We present the data collection methods and report the sensor data along with the kinematic and kinetic profiles of joint biomechanics. A comprehensive analysis of human gait and joint stiffness profiles is presented. The kinematic and kinetic analysis reveals that human walking locomotion on sand shows different ground reaction forces and joint torque profiles, compared with those patterns from walking on solid ground. These gait differences reflect that humans adopt motion control strategies for yielding terrain conditions such as sand. The dataset also provides a source of locomotion data for researchers to study human activity recognition and assistive devices for walking on different terrains."
Emergent Equivariance in Deep Ensembles,Machine Learning (cs.LG),"Jan E. Gerken, Pan Kessel","Abstract:We demonstrate that deep ensembles are secretly equivariant models. More precisely, we show that deep ensembles become equivariant for all inputs and at all training times by simply using data augmentation. Crucially, equivariance holds off-manifold and for any architecture in the infinite width limit. The equivariance is emergent in the sense that predictions of individual ensemble members are not equivariant but their collective prediction is. Neural tangent kernel theory is used to derive this result and we verify our theoretical insights using detailed numerical experiments."
"""In Dialogues We Learn"": Towards Personalized Dialogue Without  Pre-defined Profiles through In-Dialogue Learning",Computation and Language (cs.CL); Artificial Intelligence (cs.AI),"Chuanqi Cheng, Quan Tu, Wei Wu, Shuo Shang, Cunli Mao, Zhengtao Yu, Rui Yan","Abstract:Personalized dialogue systems have gained significant attention in recent years for their ability to generate responses in alignment with different personas. However, most existing approaches rely on pre-defined personal profiles, which are not only time-consuming and labor-intensive to create but also lack flexibility. We propose In-Dialogue Learning (IDL), a fine-tuning framework that enhances the ability of pre-trained large language models to leverage dialogue history to characterize persona for completing personalized dialogue generation tasks without pre-defined profiles. Our experiments on three datasets demonstrate that IDL brings substantial improvements, with BLEU and ROUGE scores increasing by up to 200% and 247%, respectively. Additionally, the results of human evaluations further validate the efficacy of our proposed method."
KnowAgent: Knowledge-Augmented Planning for LLM-Based Agents,Computation and Language (cs.CL); Artificial Intelligence (cs.AI); Human-Computer Interaction (cs.HC); Machine Learning (cs.LG); Multiagent Systems (cs.MA),"Yuqi Zhu, Shuofei Qiao, Yixin Ou, Shumin Deng, Ningyu Zhang, Shiwei Lyu, Yue Shen, Lei Liang, Jinjie Gu, Huajun Chen","Abstract:Large Language Models (LLMs) have demonstrated great potential in complex reasoning tasks, yet they fall short when tackling more sophisticated challenges, especially when interacting with environments through generating executable actions. This inadequacy primarily stems from the lack of built-in action knowledge in language agents, which fails to effectively guide the planning trajectories during task solving and results in planning hallucination. To address this issue, we introduce KnowAgent, a novel approach designed to enhance the planning capabilities of LLMs by incorporating explicit action knowledge. Specifically, KnowAgent employs an action knowledge base and a knowledgeable self-learning strategy to constrain the action path during planning, enabling more reasonable trajectory synthesis, and thereby enhancing the planning performance of language agents. Experimental results on HotpotQA and ALFWorld based on various backbone models demonstrate that KnowAgent can achieve comparable or superior performance to existing baselines. Further analysis indicates the effectiveness of KnowAgent in terms of planning hallucinations mitigation. Code is available in this https URL."
Tappy: Predicting Tap Accuracy of User-Interface Elements by  Reverse-Engineering Webpage Structures,Human-Computer Interaction (cs.HC),"Hiroki Usuba, Junichi Sato, Naomi Sasaya, Shota Yamanaka, Fumiya Yamashit","Abstract:Selecting a UI element is a fundamental operation on webpages, and the ease of tapping a target object has a significant impact on usability. It is thus important to analyze existing UIs in order to design better ones. However, tools proposed in previous studies cannot identify whether an element is tappable on modern webpages. In this study, we developed Tappy that can identify tappable UI elements on webpages and estimate the tap-success rate based on the element size. Our interviews of professional designers and engineers showed that Tappy helped discussions of UI design on the basis of its quantitative metric. Furthermore, we have launched this tool to be freely available to external users, so readers can access Tappy by visiting the website (this https URL)."
