Title,Subjects,Author(s),Abstract
"FAR: Flexible, Accurate and Robust 6DoF Relative Camera Pose Estimation",Computer Vision and Pattern Recognition (cs.CV),"Chris Rockwell, Nilesh Kulkarni, Linyi Jin, Jeong Joon Park, Justin Johnson, David F. Fouhey","Abstract:Estimating relative camera poses between images has been a central problem in computer vision. Methods that find correspondences and solve for the fundamental matrix offer high precision in most cases. Conversely, methods predicting pose directly using neural networks are more robust to limited overlap and can infer absolute translation scale, but at the expense of reduced precision. We show how to combine the best of both methods; our approach yields results that are both precise and robust, while also accurately inferring translation scales. At the heart of our model lies a Transformer that (1) learns to balance between solved and learned pose estimations, and (2) provides a prior to guide a solver. A comprehensive analysis supports our design choices and demonstrates that our method adapts flexibly to various feature extractors and correspondence estimators, showing state-of-the-art performance in 6DoF pose estimation on Matterport3D, InteriorNet, StreetLearn, and Map-free Relocalization."
LC-Tsalis-INF: Generalized Best-of-Both-Worlds Linear Contextual Bandits,Machine Learning (cs.LG); Machine Learning (stat.ML),"Masahiro Kato, Shinji Ito","Abstract:This study considers the linear contextual bandit problem with independent and identically distributed (i.i.d.) contexts. In this problem, existing studies have proposed Best-of-Both-Worlds (BoBW) algorithms whose regrets satisfy $O(\log^2(T))$ for the number of rounds $T$ in a stochastic regime with a suboptimality gap lower-bounded by a positive constant, while satisfying $O(\sqrt{T})$ in an adversarial regime. However, the dependency on $T$ has room for improvement, and the suboptimality-gap assumption can be relaxed. For this issue, this study proposes an algorithm whose regret satisfies $O(\log(T))$ in the setting when the suboptimality gap is lower-bounded. Furthermore, we introduce a margin condition, a milder assumption on the suboptimality gap. That condition characterizes the problem difficulty linked to the suboptimality gap using a parameter $\beta \in (0, \infty]$. We then show that the algorithm's regret satisfies $O\left(\left\{\log(T)\right\}^{\frac{1+\beta}{2+\beta}}T^{\frac{1}{2+\beta}}\right)$. Here, $\beta= \infty$ corresponds to the case in the existing studies where a lower bound exists in the suboptimality gap, and our regret satisfies $O(\log(T))$ in that case. Our proposed algorithm is based on the Follow-The-Regularized-Leader with the Tsallis entropy and referred to as the $\alpha$-Linear-Contextual (LC)-Tsallis-INF."
The WMDP Benchmark: Measuring and Reducing Malicious Use With Unlearning,Machine Learning (cs.LG); Artificial Intelligence (cs.AI); Computation and Language (cs.CL); Computers and Society (cs.CY),"Nathaniel Li, Alexander Pan, Anjali Gopal, Summer Yue, Daniel Berrios, Alice Gatti, Justin D. Li, Ann-Kathrin Dombrowski, Shashwat Goel, Long Phan, Gabriel Mukobi, Nathan Helm-Burger, Rassin Lababidi, Lennart Justen, Andrew B. Liu, Michael Chen, Isabelle Barrass, Oliver Zhang, Xiaoyuan Zhu, Rishub Tamirisa, Bhrugu Bharathi, Adam Khoja, Ariel Herbert-Voss, Cort B. Breuer, Andy Zou, Mantas Mazeika, Zifan Wang, Palash Oswal, Weiran Liu, Adam A. Hunt, Justin Tienken-Harder, Kevin Y. Shih, Kemper Talley, John Guan, Russell Kaplan, Ian Steneker, David Campbell, Brad Jokubaitis, Alex Levinson, Jean Wang, William Qian, Kallol Krishna Karmakar, Steven Basart, Stephen Fitz, Mindy Levine, Ponnurangam Kumaraguru, Uday Tupakula, Vijay Varadharajan, Yan Shoshitaishvili, Jimmy Ba, Kevin M. Esvelt, Alexandr Wang,  et al. (1 additional author not shown)","Abstract:The White House Executive Order on Artificial Intelligence highlights the risks of large language models (LLMs) empowering malicious actors in developing biological, cyber, and chemical weapons. To measure these risks of malicious use, government institutions and major AI labs are developing evaluations for hazardous capabilities in LLMs. However, current evaluations are private, preventing further research into mitigating risk. Furthermore, they focus on only a few, highly specific pathways for malicious use. To fill these gaps, we publicly release the Weapons of Mass Destruction Proxy (WMDP) benchmark, a dataset of 4,157 multiple-choice questions that serve as a proxy measurement of hazardous knowledge in biosecurity, cybersecurity, and chemical security. WMDP was developed by a consortium of academics and technical consultants, and was stringently filtered to eliminate sensitive information prior to public release. WMDP serves two roles: first, as an evaluation for hazardous knowledge in LLMs, and second, as a benchmark for unlearning methods to remove such hazardous knowledge. To guide progress on unlearning, we develop CUT, a state-of-the-art unlearning method based on controlling model representations. CUT reduces model performance on WMDP while maintaining general capabilities in areas such as biology and computer science, suggesting that unlearning may be a concrete path towards reducing malicious use from LLMs. We release our benchmark and code publicly at this https URL"
Self-supervised 3D Patient Modeling with Multi-modal Attentive Fusion,Computer Vision and Pattern Recognition (cs.CV),"Meng Zheng, Benjamin Planche, Xuan Gong, Fan Yang, Terrence Chen, Ziyan Wu","Abstract:3D patient body modeling is critical to the success of automated patient positioning for smart medical scanning and operating rooms. Existing CNN-based end-to-end patient modeling solutions typically require a) customized network designs demanding large amount of relevant training data, covering extensive realistic clinical scenarios (e.g., patient covered by sheets), which leads to suboptimal generalizability in practical deployment, b) expensive 3D human model annotations, i.e., requiring huge amount of manual effort, resulting in systems that scale poorly. To address these issues, we propose a generic modularized 3D patient modeling method consists of (a) a multi-modal keypoint detection module with attentive fusion for 2D patient joint localization, to learn complementary cross-modality patient body information, leading to improved keypoint localization robustness and generalizability in a wide variety of imaging (e.g., CT, MRI etc.) and clinical scenarios (e.g., heavy occlusions); and (b) a self-supervised 3D mesh regression module which does not require expensive 3D mesh parameter annotations to train, bringing immediate cost benefits for clinical deployment. We demonstrate the efficacy of the proposed method by extensive patient positioning experiments on both public and clinical data. Our evaluation results achieve superior patient positioning performance across various imaging modalities in real clinical scenarios."
A Safety-Critical Framework for UGVs in Complex Environments: A  Data-Driven Discrepancy-Aware Approach,Robotics (cs.RO),"Skylar X. Wei, Lu Gan, Joel W. Burdick","Abstract:This work presents a novel data-driven multi-layered planning and control framework for the safe navigation of a class of unmanned ground vehicles (UGVs) in the presence of unknown stationary obstacles and additive modeling uncertainties. The foundation of this framework is a novel robust model predictive planner, designed to generate optimal collision-free trajectories given an occupancy grid map, and a paired ancillary controller, augmented to provide robustness against model uncertainties extracted from learning data.
To tackle modeling discrepancies, we identify both matched (input discrepancies) and unmatched model residuals between the true and the nominal reduced-order models using closed-loop tracking errors as training data. Utilizing conformal prediction, we extract probabilistic upper bounds for the unknown model residuals, which serve to construct a robustifying ancillary controller. Further, we also determine maximum tracking discrepancies, also known as the robust control invariance tube, under the augmented policy, formulating them as collision buffers. Employing a LiDAR-based occupancy map to characterize the environment, we construct a discrepancy-aware cost map that incorporates these collision buffers. This map is then integrated into a sampling-based model predictive path planner that generates optimal and safe trajectories that can be robustly tracked by the augmented ancillary controller in the presence of model mismatches.
The effectiveness of the framework is experimentally validated for autonomous high-speed trajectory tracking in a cluttered environment with four different vehicle-terrain configurations. We also showcase the framework's versatility by reformulating it as a driver-assist program, providing collision avoidance corrections based on user joystick commands."
On the computation of lattice sums without translational invariance,Numerical Analysis (math.NA); Strongly Correlated Electrons (cond-mat.str-el); High Energy Physics - Lattice (hep-lat),"Andreas A. Buchheit, Torsten Keßler, Kirill Serkh","Abstract:This work introduces a framework for the efficient computation of oscillatory multidimensional lattice sums in geometries with boundaries, a problem intersecting pure and applied mathematics with immediate applications in condensed matter physics and topological quantum physics. The challenge in evaluating the arising sums results from the combination of singular long-range interactions with the loss of translational invariance caused by the boundaries, rendering standard tools ineffective. Our work shows that these lattice sums can be generated from a generalization of the Riemann zeta function to multidimensional non-periodic lattice sums. We put forth a new representation of this zeta function together with a numerical algorithm that ensures super-exponential convergence across an extensive range of geometries. Notably, our method's runtime is influenced only by the complexity of the considered geometries and not by the sheer number of particles, providing the foundation for efficient simulations of macroscopic condensed matter systems. We showcase the practical utility of our method by computing interaction energies in a three-dimensional crystal structure with $3\times 10^{23}$ particles. Our method's accuracy is thoroughly assessed through a detailed error analysis that both uses analytical results and numerical experiments. A reference implementation is provided online along with the article"
Scaling Rectified Flow Transformers for High-Resolution Image Synthesis,Computer Vision and Pattern Recognition (cs.CV),"Patrick Esser, Sumith Kulal, Andreas Blattmann, Rahim Entezari, Jonas Müller, Harry Saini, Yam Levi, Dominik Lorenz, Axel Sauer, Frederic Boesel, Dustin Podell, Tim Dockhorn, Zion English, Kyle Lacey, Alex Goodwin, Yannik Marek, Robin Rombach","Abstract:Diffusion models create data from noise by inverting the forward paths of data towards noise and have emerged as a powerful generative modeling technique for high-dimensional, perceptual data such as images and videos. Rectified flow is a recent generative model formulation that connects data and noise in a straight line. Despite its better theoretical properties and conceptual simplicity, it is not yet decisively established as standard practice. In this work, we improve existing noise sampling techniques for training rectified flow models by biasing them towards perceptually relevant scales. Through a large-scale study, we demonstrate the superior performance of this approach compared to established diffusion formulations for high-resolution text-to-image synthesis. Additionally, we present a novel transformer-based architecture for text-to-image generation that uses separate weights for the two modalities and enables a bidirectional flow of information between image and text tokens, improving text comprehension, typography, and human preference ratings. We demonstrate that this architecture follows predictable scaling trends and correlates lower validation loss to improved text-to-image synthesis as measured by various metrics and human evaluations. Our largest models outperform state-of-the-art models, and we will make our experimental data, code, and model weights publicly available."
CLEVR-POC: Reasoning-Intensive Visual Question Answering in Partially  Observable Environments,Artificial Intelligence (cs.AI),"Savitha Sam Abraham, Marjan Alirezaie, Luc De Raedt","Abstract:The integration of learning and reasoning is high on the research agenda in AI. Nevertheless, there is only a little attention to use existing background knowledge for reasoning about partially observed scenes to answer questions about the scene. Yet, we as humans use such knowledge frequently to infer plausible answers to visual questions (by eliminating all inconsistent ones). Such knowledge often comes in the form of constraints about objects and it tends to be highly domain or environment-specific. We contribute a novel benchmark called CLEVR-POC for reasoning-intensive visual question answering (VQA) in partially observable environments under constraints. In CLEVR-POC, knowledge in the form of logical constraints needs to be leveraged to generate plausible answers to questions about a hidden object in a given partial scene. For instance, if one has the knowledge that all cups are colored either red, green or blue and that there is only one green cup, it becomes possible to deduce the color of an occluded cup as either red or blue, provided that all other cups, including the green one, are observed. Through experiments, we observe that the low performance of pre-trained vision language models like CLIP (~ 22%) and a large language model (LLM) like GPT-4 (~ 46%) on CLEVR-POC ascertains the necessity for frameworks that can handle reasoning-intensive tasks where environment-specific background knowledge is available and crucial. Furthermore, our demonstration illustrates that a neuro-symbolic model, which integrates an LLM like GPT-4 with a visual perception network and a formal logical reasoner, exhibits exceptional performance on CLEVR-POC."
SmartSantander: IoT Experimentation over a Smart City Testbed,Networking and Internet Architecture (cs.NI); Systems and Control (eess.SY),"Luis Sanchez, Luis Muñoz, Jose Antonio Galache, Pablo Sotres, Juan R. Santana, Veronica Gutierrez, Rajiv Ramdhany, Alex Gluhak, Srdjan Krco, Evangelos Theodoridis, Dennis Pfisterer","Abstract:This paper describes the deployment and experimentation architecture of the Internet of Things experimentation facility being deployed at Santander city. The facility is implemented within the SmartSantander project, one of the projects of the Future Internet Research and Experimentation initiative of the European Commission and represents a unique in the world city-scale experimental research facility. Additionally, this facility supports typical applications and services of a smart city. Tangible results are expected to influence the definition and specification of Future Internet architecture design from viewpoints of Internet of Things and Internet of Services. The facility comprises a large number of Internet of Things devices deployed in several urban scenarios which will be federated into a single testbed. In this paper the deployment being carried out at the main location, namely Santander city, is described. Besides presenting the current deployment, in this article the main insights in terms of the architectural design of a large-scale IoT testbed are presented as well. Furthermore, solutions adopted for implementation of the different components addressing the required testbed functionalities are also sketched out. The IoT experimentation facility described in this paper is conceived to provide a suitable platform for large scale experimentation and evaluation of IoT concepts under real-life conditions."
MAGID: An Automated Pipeline for Generating Synthetic Multi-modal  Datasets,Computation and Language (cs.CL),"Hossein Aboutalebi, Hwanjun Song, Yusheng Xie, Arshit Gupta, Justin Sun, Hang Su, Igor Shalyminov, Nikolaos Pappas, Siffi Singh, Saab Mansour","Abstract:Development of multimodal interactive systems is hindered by the lack of rich, multimodal (text, images) conversational data, which is needed in large quantities for LLMs. Previous approaches augment textual dialogues with retrieved images, posing privacy, diversity, and quality constraints. In this work, we introduce \textbf{M}ultimodal \textbf{A}ugmented \textbf{G}enerative \textbf{I}mages \textbf{D}ialogues (MAGID), a framework to augment text-only dialogues with diverse and high-quality images. Subsequently, a diffusion model is applied to craft corresponding images, ensuring alignment with the identified text. Finally, MAGID incorporates an innovative feedback loop between an image description generation module (textual LLM) and image quality modules (addressing aesthetics, image-text matching, and safety), that work in tandem to generate high-quality and multi-modal dialogues. We compare MAGID to other SOTA baselines on three dialogue datasets, using automated and human evaluation. Our results show that MAGID is comparable to or better than baselines, with significant improvements in human evaluation, especially against retrieval baselines where the image database is small."
VeriEQL: Bounded Equivalence Verification for Complex SQL Queries with  Integrity Constraints,Programming Languages (cs.PL); Databases (cs.DB),"Yang He, Pinhan Zhao, Xinyu Wang, Yuepeng Wang","Abstract:The task of SQL query equivalence checking is important in various real-world applications (including query rewriting and automated grading) that involve complex queries with integrity constraints; yet, state-of-the-art techniques are very limited in their capability of reasoning about complex features (e.g., those that involve sorting, case statement, rich integrity constraints, etc.) in real-life queries. To the best of our knowledge, we propose the first SMT-based approach and its implementation, VeriEQL, capable of proving and disproving bounded equivalence of complex SQL queries. VeriEQL is based on a new logical encoding that models query semantics over symbolic tuples using the theory of integers with uninterpreted functions. It is simple yet highly practical -- our comprehensive evaluation on over 20,000 benchmarks shows that VeriEQL outperforms all state-of-the-art techniques by more than one order of magnitude in terms of the number of benchmarks that can be proved or disproved. VeriEQL can also generate counterexamples that facilitate many downstream tasks (such as finding serious bugs in systems like MySQL and Apache Calcite)."
Triple-CFN: Restructuring Conceptual Spaces for Enhancing Abstract  Reasoning process,Computer Vision and Pattern Recognition (cs.CV),"Ruizhuo Song, Beiming Yuan","Abstract:Abstract reasoning problems pose significant challenges to artificial intelligence algorithms, demanding cognitive capabilities beyond those required for perception tasks. This study introduces the Triple-CFN approach to tackle the Bongard-Logo problem, achieving notable reasoning accuracy by implicitly reorganizing the concept space of conflicting instances. Additionally, the Triple-CFN paradigm proves effective for the RPM problem with necessary modifications, yielding competitive results. To further enhance performance on the RPM issue, we develop the Meta Triple-CFN network, which explicitly structures the problem space while maintaining interpretability on progressive patterns. The success of Meta Triple-CFN is attributed to its paradigm of modeling the conceptual space, equivalent to normalizing reasoning information. Based on this ideology, we introduce the Re-space layer, enhancing the performance of both Meta Triple-CFN and Triple-CFN. This paper aims to contribute to advancements in machine intelligence by exploring innovative network designs for addressing abstract reasoning problems, paving the way for further breakthroughs in this domain."
Towards Democratized Flood Risk Management: An Advanced AI Assistant  Enabled by GPT-4 for Enhanced Interpretability and Public Engagement,Artificial Intelligence (cs.AI); Computers and Society (cs.CY); Human-Computer Interaction (cs.HC),"Rafaela Martelo, Ruo-Qian Wang (Rutgers University)","Abstract:Real-time flood forecasting plays a crucial role in enabling timely and effective emergency responses. However, a significant challenge lies in bridging the gap between complex numerical flood models and practical decision-making. Decision-makers often rely on experts to interpret these models for optimizing flood mitigation strategies. And the public requires complex techniques to inquiry and understand socio-cultural and institutional factors, often hinders the public's understanding of flood risks. To overcome these challenges, our study introduces an innovative solution: a customized AI Assistant powered by the GPT-4 Large Language Model. This AI Assistant is designed to facilitate effective communication between decision-makers, the general public, and flood forecasters, without the requirement of specialized knowledge. The new framework utilizes GPT-4's advanced natural language understanding and function calling capabilities to provide immediate flood alerts and respond to various flood-related inquiries. Our developed prototype integrates real-time flood warnings with flood maps and social vulnerability data. It also effectively translates complex flood zone information into actionable risk management advice. To assess its performance, we evaluated the prototype using six criteria within three main categories: relevance, error resilience, and understanding of context. Our research marks a significant step towards a more accessible and user-friendly approach in flood risk management. This study highlights the potential of advanced AI tools like GPT-4 in democratizing information and enhancing public engagement in critical social and environmental issues."
"Reliable, Adaptable, and Attributable Language Models with Retrieval",Computation and Language (cs.CL); Artificial Intelligence (cs.AI); Machine Learning (cs.LG),"Akari Asai, Zexuan Zhong, Danqi Chen, Pang Wei Koh, Luke Zettlemoyer, Hannaneh Hajishirzi, Wen-tau Yih","Abstract:Parametric language models (LMs), which are trained on vast amounts of web data, exhibit remarkable flexibility and capability. However, they still face practical challenges such as hallucinations, difficulty in adapting to new data distributions, and a lack of verifiability. In this position paper, we advocate for retrieval-augmented LMs to replace parametric LMs as the next generation of LMs. By incorporating large-scale datastores during inference, retrieval-augmented LMs can be more reliable, adaptable, and attributable. Despite their potential, retrieval-augmented LMs have yet to be widely adopted due to several obstacles: specifically, current retrieval-augmented LMs struggle to leverage helpful text beyond knowledge-intensive tasks such as question answering, have limited interaction between retrieval and LM components, and lack the infrastructure for scaling. To address these, we propose a roadmap for developing general-purpose retrieval-augmented LMs. This involves a reconsideration of datastores and retrievers, the exploration of pipelines with improved retriever-LM interaction, and significant investment in infrastructure for efficient training and inference."
Towards General Computer Control: A Multimodal Agent for Red Dead  Redemption II as a Case Study,Artificial Intelligence (cs.AI),"Weihao Tan, Ziluo Ding, Wentao Zhang, Boyu Li, Bohan Zhou, Junpeng Yue, Haochong Xia, Jiechuan Jiang, Longtao Zheng, Xinrun Xu, Yifei Bi, Pengjie Gu, Xinrun Wang, Börje F. Karlsson, Bo An, Zongqing Lu","Abstract:Recent studies have demonstrated the success of foundation agents in specific tasks or scenarios. However, existing agents cannot generalize across different scenarios, mainly due to their diverse observation and action spaces and semantic gaps, or reliance on task-specific resources. In this work, we propose the General Computer Control (GCC) setting: building foundation agents that can master any computer task by taking only screen images (and possibly audio) of the computer as input, and producing keyboard and mouse operations as output, similar to human-computer interaction. To target GCC, we propose Cradle, an agent framework with strong reasoning abilities, including self-reflection, task inference, and skill curation, to ensure generalizability and self-improvement across various tasks. To demonstrate the capabilities of Cradle, we deploy it in the complex AAA game Red Dead Redemption II, serving as a preliminary attempt towards GCC with a challenging target. Our agent can follow the main storyline and finish real missions in this complex AAA game, with minimal reliance on prior knowledge and application-specific resources. The project website is at this https URL."
