Title,Subjects,Author(s),Abstract
Unifying Controller Design for Stabilizing Nonlinear Systems with  Norm-Bounded Control Inputs,Systems and Control (eess.SY); Artificial Intelligence (cs.AI); Optimization and Control (math.OC),"Ming Li, Zhiyong Sun, Siep Weiland","Abstract:This paper revisits a classical challenge in the design of stabilizing controllers for nonlinear systems with a norm-bounded input constraint. By extending Lin-Sontag's universal formula and introducing a generic (state-dependent) scaling term, a unifying controller design method is proposed. The incorporation of this generic scaling term gives a unified controller and enables the derivation of alternative universal formulas with various favorable properties, which makes it suitable for tailored control designs to meet specific requirements and provides versatility across different control scenarios. Additionally, we present a constructive approach to determine the optimal scaling term, leading to an explicit solution to an optimization problem, named optimization-based universal formula. The resulting controller ensures asymptotic stability, satisfies a norm-bounded input constraint, and optimizes a predefined cost function. Finally, the essential properties of the unified controllers are analyzed, including smoothness, continuity at the origin, stability margin, and inverse optimality. Simulations validate the approach, showcasing its effectiveness in addressing a challenging stabilizing control problem of a nonlinear system."
Socratic Reasoning Improves Positive Text Rewriting,Computation and Language (cs.CL),"Anmol Goel, Nico Daheim, Iryna Gurevych","Abstract:Reframing a negative into a positive thought is at the crux of several cognitive approaches to mental health and psychotherapy that could be made more accessible by large language model-based solutions. Such reframing is typically non-trivial and requires multiple rationalization steps to uncover the underlying issue of a negative thought and transform it to be more positive. However, this rationalization process is currently neglected by both datasets and models which reframe thoughts in one step. In this work, we address this gap by augmenting open-source datasets for positive text rewriting with synthetically-generated Socratic rationales using a novel framework called \textsc{SocraticReframe}. \textsc{SocraticReframe} uses a sequence of question-answer pairs to rationalize the thought rewriting process. We show that such Socratic rationales significantly improve positive text rewriting for different open-source LLMs according to both automatic and human evaluations guided by criteria from psychotherapy research."
Word Importance Explains How Prompts Affect Language Model Outputs,Artificial Intelligence (cs.AI); Computation and Language (cs.CL),"Stefan Hackmann, Haniyeh Mahmoudian, Mark Steadman, Michael Schmidt","Abstract:The emergence of large language models (LLMs) has revolutionized numerous applications across industries. However, their ""black box"" nature often hinders the understanding of how they make specific decisions, raising concerns about their transparency, reliability, and ethical use. This study presents a method to improve the explainability of LLMs by varying individual words in prompts to uncover their statistical impact on the model outputs. This approach, inspired by permutation importance for tabular data, masks each word in the system prompt and evaluates its effect on the outputs based on the available text scores aggregated over multiple user inputs. Unlike classical attention, word importance measures the impact of prompt words on arbitrarily-defined text scores, which enables decomposing the importance of words into the specific measures of interest--including bias, reading level, verbosity, etc. This procedure also enables measuring impact when attention weights are not available. To test the fidelity of this approach, we explore the effect of adding different suffixes to multiple different system prompts and comparing subsequent generations with different large language models. Results show that word importance scores are closely related to the expected suffix importances for multiple scoring functions."
Toward Improved Deep Learning-based Vulnerability Detection,Software Engineering (cs.SE),"Adriana Sejfia, Satyaki Das, Saad Shafiq, Nenad Medvidović","Abstract:Deep learning (DL) has been a common thread across several recent techniques for vulnerability detection. The rise of large, publicly available datasets of vulnerabilities has fueled the learning process underpinning these techniques. While these datasets help the DL-based vulnerability detectors, they also constrain these detectors' predictive abilities. Vulnerabilities in these datasets have to be represented in a certain way, e.g., code lines, functions, or program slices within which the vulnerabilities exist. We refer to this representation as a base unit. The detectors learn how base units can be vulnerable and then predict whether other base units are vulnerable. We have hypothesized that this focus on individual base units harms the ability of the detectors to properly detect those vulnerabilities that span multiple base units (or MBU vulnerabilities). For vulnerabilities such as these, a correct detection occurs when all comprising base units are detected as vulnerable. Verifying how existing techniques perform in detecting all parts of a vulnerability is important to establish their effectiveness for other downstream tasks. To evaluate our hypothesis, we conducted a study focusing on three prominent DL-based detectors: ReVeal, DeepWukong, and LineVul. Our study shows that all three detectors contain MBU vulnerabilities in their respective datasets. Further, we observed significant accuracy drops when detecting these types of vulnerabilities. We present our study and a framework that can be used to help DL-based detectors toward the proper inclusion of MBU vulnerabilities."
Accelerating the convergence of Newton's method for nonlinear elliptic  PDEs using Fourier neural operators,Numerical Analysis (math.NA),"Joubine Aghili, Emmanuel Franck, Romain Hild, Victor Michel-Dansac, Vincent Vigon","Abstract:It is well known that Newton's method, especially when applied to large problems such as the discretization of nonlinear partial differential equations (PDEs), can have trouble converging if the initial guess is too far from the solution. This work focuses on accelerating this convergence, in the context of the discretization of nonlinear elliptic PDEs. We first provide a quick review of existing methods, and justify our choice of learning an initial guess with a Fourier neural operator (FNO). This choice was motivated by the mesh-independence of such operators, whose training and evaluation can be performed on grids with different resolutions. The FNO is trained using a loss minimization over generated data, loss functions based on the PDE discretization. Numerical results, in one and two dimensions, show that the proposed initial guess accelerates the convergence of Newton's method by a large margin compared to a naive initial guess, especially for highly nonlinear or anisotropic problems."
SplAgger: Split Aggregation for Meta-Reinforcement Learning,Machine Learning (cs.LG); Artificial Intelligence (cs.AI),"Jacob Beck, Matthew Jackson, Risto Vuorio, Zheng Xiong, Shimon Whiteson","Abstract:A core ambition of reinforcement learning (RL) is the creation of agents capable of rapid learning in novel tasks. Meta-RL aims to achieve this by directly learning such agents. One category of meta-RL methods, called black box methods, does so by training off-the-shelf sequence models end-to-end. In contrast, another category of methods have been developed that explicitly infer a posterior distribution over the unknown task. These methods generally have distinct objectives and sequence models designed to enable task inference, and so are known as task inference methods. However, recent evidence suggests that task inference objectives are unnecessary in practice. Nonetheless, it remains unclear whether task inference sequence models are beneficial even when task inference objectives are not. In this paper, we present strong evidence that task inference sequence models are still beneficial. In particular, we investigate sequence models with permutation invariant aggregation, which exploit the fact that, due to the Markov property, the task posterior does not depend on the order of data. We empirically confirm the advantage of permutation invariant sequence models without the use of task inference objectives. However, we also find, surprisingly, that there are multiple conditions under which permutation variance remains useful. Therefore, we propose SplAgger, which uses both permutation variant and invariant components to achieve the best of both worlds, outperforming all baselines on continuous control and memory environments."
CRISPR: Ensemble Model,Machine Learning (cs.LG); Genomics (q-bio.GN),"Mohammad Rostami, Amin Ghariyazi, Hamed Dashti, Mohammad Hossein Rohban, Hamid R. Rabiee","Abstract:Clustered Regularly Interspaced Short Palindromic Repeats (CRISPR) is a gene editing technology that has revolutionized the fields of biology and medicine. However, one of the challenges of using CRISPR is predicting the on-target efficacy and off-target sensitivity of single-guide RNAs (sgRNAs). This is because most existing methods are trained on separate datasets with different genes and cells, which limits their generalizability. In this paper, we propose a novel ensemble learning method for sgRNA design that is accurate and generalizable. Our method combines the predictions of multiple machine learning models to produce a single, more robust prediction. This approach allows us to learn from a wider range of data, which improves the generalizability of our model. We evaluated our method on a benchmark dataset of sgRNA designs and found that it outperformed existing methods in terms of both accuracy and generalizability. Our results suggest that our method can be used to design sgRNAs with high sensitivity and specificity, even for new genes or cells. This could have important implications for the clinical use of CRISPR, as it would allow researchers to design more effective and safer treatments for a variety of diseases."
OPEx: A Component-Wise Analysis of LLM-Centric Agents in Embodied  Instruction Following,Artificial Intelligence (cs.AI),"Haochen Shi, Zhiyuan Sun, Xingdi Yuan, Marc-Alexandre Côté, Bang Liu","Abstract:Embodied Instruction Following (EIF) is a crucial task in embodied learning, requiring agents to interact with their environment through egocentric observations to fulfill natural language instructions. Recent advancements have seen a surge in employing large language models (LLMs) within a framework-centric approach to enhance performance in embodied learning tasks, including EIF. Despite these efforts, there exists a lack of a unified understanding regarding the impact of various components-ranging from visual perception to action execution-on task performance. To address this gap, we introduce OPEx, a comprehensive framework that delineates the core components essential for solving embodied learning tasks: Observer, Planner, and Executor. Through extensive evaluations, we provide a deep analysis of how each component influences EIF task performance. Furthermore, we innovate within this space by deploying a multi-agent dialogue strategy on a TextWorld counterpart, further enhancing task performance. Our findings reveal that LLM-centric design markedly improves EIF outcomes, identify visual perception and low-level action execution as critical bottlenecks, and demonstrate that augmenting LLMs with a multi-agent framework further elevates performance."
Low Complexity Channel Estimation for RIS-Assisted THz Systems with Beam  Split,Information Theory (cs.IT); Signal Processing (eess.SP),"Xin Su, Ruisi He, Peng Zhang, Bo Ai","Abstract:To support extremely high data rates, reconfigurable intelligent surface (RIS)-assisted terahertz (THz) communication is considered to be a promising technology for future sixth-generation networks. However, due to the typical employment of hybrid beamforming architecture in THz systems, as well as the passive nature of RIS which lacks the capability to process pilot signals, obtaining channel state information (CSI) is facing significant challenges. To accurately estimate the cascaded channel, we propose a novel low-complexity channel estimation scheme, which includes three steps. Specifically, we first estimate full CSI within a small subset of subcarriers (SCs). Then, we acquire angular information at base station and RIS based on the full CSI. Finally, we derive spatial directions and recover full-CSI for the remaining SCs. Theoretical analysis and simulation results demonstrate that the proposed scheme can achieve superior performance in terms of normalized mean-square-error and exhibit a lower computational complexity compared with the existing algorithms."
The Case for Evaluating Multimodal Translation Models on Text Datasets,Computation and Language (cs.CL),"Vipin Vijayan, Braeden Bowen, Scott Grigsby, Timothy Anderson, Jeremy Gwinnup","Abstract:A good evaluation framework should evaluate multimodal machine translation (MMT) models by measuring 1) their use of visual information to aid in the translation task and 2) their ability to translate complex sentences such as done for text-only machine translation. However, most current work in MMT is evaluated against the Multi30k testing sets, which do not measure these properties. Namely, the use of visual information by the MMT model cannot be shown directly from the Multi30k test set results and the sentences in Multi30k are are image captions, i.e., short, descriptive sentences, as opposed to complex sentences that typical text-only machine translation models are evaluated against.
Therefore, we propose that MMT models be evaluated using 1) the CoMMuTE evaluation framework, which measures the use of visual information by MMT models, 2) the text-only WMT news translation task test sets, which evaluates translation performance against complex sentences, and 3) the Multi30k test sets, for measuring MMT model performance against a real MMT dataset. Finally, we evaluate recent MMT models trained solely against the Multi30k dataset against our proposed evaluation framework and demonstrate the dramatic drop performance against text-only testing sets compared to recent text-only MT models."
Knowledge Graphs as Context Sources for LLM-Based Explanations of  Learning Recommendations,Artificial Intelligence (cs.AI),"Hasan Abu-Rasheed, Christian Weber, Madjid Fathi","Abstract:In the era of personalized education, the provision of comprehensible explanations for learning recommendations is of a great value to enhance the learner's understanding and engagement with the recommended learning content. Large language models (LLMs) and generative AI in general have recently opened new doors for generating human-like explanations, for and along learning recommendations. However, their precision is still far away from acceptable in a sensitive field like education. To harness the abilities of LLMs, while still ensuring a high level of precision towards the intent of the learners, this paper proposes an approach to utilize knowledge graphs (KG) as a source of factual context, for LLM prompts, reducing the risk of model hallucinations, and safeguarding against wrong or imprecise information, while maintaining an application-intended learning context. We utilize the semantic relations in the knowledge graph to offer curated knowledge about learning recommendations. With domain-experts in the loop, we design the explanation as a textual template, which is filled and completed by the LLM. Domain experts were integrated in the prompt engineering phase as part of a study, to ensure that explanations include information that is relevant to the learner. We evaluate our approach quantitatively using Rouge-N and Rouge-L measures, as well as qualitatively with experts and learners. Our results show an enhanced recall and precision of the generated explanations compared to those generated solely by the GPT model, with a greatly reduced risk of generating imprecise information in the final learning explanation."
Implicit-Explicit simulation of Mass-Spring-Charge Systems,Graphics (cs.GR),"Zhiyuan Zhang, Zhaocheng Liu, Stefanos Papanicolopulos, Kartic Subr","Abstract:Point masses connected by springs, or mass-spring systems, are widely used in computer animation to approximate the behavior of deformable objects. One of the restrictions imposed by these models is that points that are not topologically constrained (linked by a spring) are unable to interact with each other explicitly. Such interactions would introduce a new dimension for artistic control and animation within the computer graphics community. Beyond graphics, such a model could be an effective proxy to use for model-based learning of complex physical systems such as molecular biology. We propose to imbue masses in a mass-spring system with electrostatic charge leading a system with internal forces between all pairs of charged points -- regardless of whether they are linked by a spring. We provide a practical and stable algorithm to simulate charged mass-spring systems over long time horizons. We demonstrate how these systems may be controlled via parameters such as guidance electric fields or external charges, thus presenting fresh opportunities for artistic authoring. Our method is especially appropriate for computer graphics applications due to its robustness at larger simulation time steps."
Feast Your Eyes: Mixture-of-Resolution Adaptation for Multimodal Large  Language Models,Computer Vision and Pattern Recognition (cs.CV),"Gen Luo, Yiyi Zhou, Yuxin Zhang, Xiawu Zheng, Xiaoshuai Sun, Rongrong Ji","Abstract:Despite remarkable progress, existing multimodal large language models (MLLMs) are still inferior in granular visual recognition. Contrary to previous works, we study this problem from the perspective of image resolution, and reveal that a combination of low- and high-resolution visual features can effectively mitigate this shortcoming. Based on this observation, we propose a novel and efficient method for MLLMs, termed Mixture-of-Resolution Adaptation (MRA). In particular, MRA adopts two visual pathways for images with different resolutions, where high-resolution visual information is embedded into the low-resolution pathway via the novel mixture-of-resolution adapters (MR-Adapters). This design also greatly reduces the input sequence length of MLLMs. To validate MRA, we apply it to a recent MLLM called LLaVA, and term the new model LLaVA-HR. We conduct extensive experiments on 11 vision-language (VL) tasks, which show that LLaVA-HR outperforms existing MLLMs on 8 VL tasks, e.g., +9.4% on TextVQA. More importantly, both training and inference of LLaVA-HR remain efficient with MRA, e.g., 20 training hours and 3$\times$ inference speed than LLaVA-1.5. Source codes are released at: this https URL."
Mem-elements based Neuromorphic Hardware for Neural Network Application,Neural and Evolutionary Computing (cs.NE); Artificial Intelligence (cs.AI); Emerging Technologies (cs.ET),Ankur Singh,"Abstract:The thesis investigates the utilization of memristive and memcapacitive crossbar arrays in low-power machine learning accelerators, offering a comprehensive co-design framework for deep neural networks (DNN). The model, implemented through a hybrid Python and PyTorch approach, accounts for various non-idealities, achieving exceptional training accuracies of 90.02% and 91.03% for the CIFAR-10 dataset with memristive and memcapacitive crossbar arrays on an 8-layer VGG network. Additionally, the thesis introduces a novel approach to emulate meminductor devices using Operational Transconductance Amplifiers (OTA) and capacitors, showcasing adjustable behavior. Transistor-level simulations in 180 nm CMOS technology, operating at 60 MHz, demonstrate the proposed meminductor emulator's viability with a power consumption of 0.337 mW. The design is further validated in neuromorphic circuits and CNN accelerators, achieving training and testing accuracies of 91.04% and 88.82%, respectively. Notably, the exclusive use of MOS transistors ensures the feasibility of monolithic IC fabrication. This research significantly contributes to the exploration of advanced hardware solutions for efficient and high-performance machine-learning applications."
Towards Calibrated Deep Clustering Network,Computer Vision and Pattern Recognition (cs.CV),"Yuheng Jia, Jianhong Cheng, Hui Liu, Junhui Hou","Abstract:Deep clustering has exhibited remarkable performance; however, the overconfidence problem, i.e., the estimated confidence for a sample belonging to a particular cluster greatly exceeds its actual prediction accuracy, has been overlooked in prior research. To tackle this critical issue, we pioneer the development of a calibrated deep clustering framework. Specifically, we propose a novel dual-head deep clustering pipeline that can effectively calibrate the estimated confidence and the actual accuracy. The calibration head adjusts the overconfident predictions of the clustering head using regularization methods, generating prediction confidence and pseudo-labels that match the model learning status. This calibration process also guides the clustering head in dynamically selecting reliable high-confidence samples for training. Additionally, we introduce an effective network initialization strategy that enhances both training speed and network robustness. Extensive experiments demonstrate the proposed calibrated deep clustering framework not only surpasses state-of-the-art deep clustering methods by approximately 10 times in terms of expected calibration error but also significantly outperforms them in terms of clustering accuracy."
Cover Edge-Based Novel Triangle Counting,Data Structures and Algorithms (cs.DS),"David A. Bader, Fuhuan Li, Zhihui Du, Palina Pauliuchenka, Oliver Alvarado Rodriguez, Anant Gupta, Sai Sri Vastav Minnal, Valmik Nahata, Anya Ganeshan, Ahmet Gundogdu, Jason Lew","Abstract:Listing and counting triangles in graphs is a key algorithmic kernel for network analyses, including community detection, clustering coefficients, k-trusses, and triangle centrality. In this paper, we propose the novel concept of a cover-edge set that can be used to find triangles more efficiently. Leveraging the breadth-first search (BFS) method, we can quickly generate a compact cover-edge set. Novel sequential and parallel triangle counting algorithms that employ cover-edge sets are presented. The novel sequential algorithm performs competitively with the fastest previous approaches on both real and synthetic graphs, such as those from the Graph500 Benchmark and the MIT/Amazon/IEEE Graph Challenge. We implement 22 sequential algorithms for performance evaluation and comparison. At the same time, we employ OpenMP to parallelize 11 sequential algorithms, presenting an in-depth analysis of their parallel performance. Furthermore, we develop a distributed parallel algorithm that can asymptotically reduce communication on massive graphs. In our estimate from massive-scale Graph500 graphs, our distributed parallel algorithm can reduce the communication on a scale~36 graph by 1156x and on a scale~42 graph by 2368x. Comprehensive experiments are conducted on the recently launched Intel Xeon 8480+ processor and shed light on how graph attributes, such as topology, diameter, and degree distribution, can affect the performance of these algorithms."
A Convex Optimization Framework for Computing Robustness Margins of  Kalman Filters,Systems and Control (eess.SY); Optimization and Control (math.OC); Applications (stat.AP),"Himanshu Prabhat, Raktim Bhattacharya",Abstract:This paper proposes a novel convex optimization framework for designing robust Kalman filters that guarantee a user-specified steady-state error while maximizing process and sensor noise. The proposed framework simultaneously determines the Kalman gain and the robustness margin in terms of the process and sensor noise. This is the first paper to present such a joint formulation for Kalman filtering. The proposed methodology is validated through two distinct examples: the Clohessy-Wiltshire-Hill equations for a chaser spacecraft in an elliptical orbit and the longitudinal motion model of an F-16 aircraft.
